StockCode,Description,Category,Subcategory
21814,HEART T-LIGHT HOLDER ,Air fragances,Candles
21815,STAR  T-LIGHT HOLDER ,Air fragances,Candles
21816,CHRISTMAS TREE T-LIGHT HOLDER,Air fragances,Candles
21817,GLITTER CHRISTMAS TREE,Seasonal,Christmas
21818,GLITTER CHRISTMAS HEART ,Seasonal,Christmas
21819,GLITTER CHRISTMAS STAR ,Seasonal,Christmas
21820,GLITTER HEART GARLAND WITH BELLS ,Kids,Party
21821,GLITTER STAR GARLAND WITH BELLS ,Kids,Party
21822,GLITTER CHRISTMAS TREE WITH BELLS,Seasonal,Christmas
21829,DINOSAUR KEYRINGS ASSORTED,Accessories,Bijoux
21832,CHOCOLATE CALCULATOR,Accessories,Tech
21836,GINGHAM OVEN GLOVE RED HEART ,Home,Kitchen
21837,CROSS STITCH ALPHABET CUSHION COVER,Home,Furniture
21839,MUMMY MOUSE RED GINGHAM RIBBON,Stationery,Gifts
21842,PINK HEART CANDY BUTTON CALCULATOR,Accessories,Tech
21843,RED RETROSPOT CAKE STAND,Home,Kitchen
21844,RED RETROSPOT MUG,Home,Kitchen
21845,DAIRY MAID STRIPE MUG,Home,Kitchen
21846,PINK DIAMANTE PEN IN GIFT BOX,Stationery,Desktop Stationery
21847,GREEN  DIAMANTE PEN IN GIFT BOX,Stationery,Desktop Stationery
21849,SILVER DIAMANTE PEN IN GIFT BOX,Stationery,Desktop Stationery
21850,BLUE  DIAMANTE PEN IN GIFT BOX,Stationery,Desktop Stationery
21851,LILAC DIAMANTE PEN IN GIFT BOX,Stationery,Desktop Stationery
21864,UNION JACK FLAG PASSPORT COVER ,Accessories,Bags
21865,PINK UNION JACK  PASSPORT COVER ,Accessories,Bags
21866,UNION JACK FLAG LUGGAGE TAG,Accessories,Bags
21867,PINK UNION JACK  LUGGAGE TAG,Accessories,Bags
21868,POTTING SHED TEA MUG,Home,Kitchen
21869,POTTING SHED COFFEE MUG,Home,Kitchen
21870,I CAN ONLY PLEASE ONE PERSON MUG,Home,Kitchen
21871,SAVE THE PLANET MUG,Home,Kitchen
21872,GLAMOROUS  MUG,Home,Kitchen
21873,IF YOU CAN'T STAND THE HEAT MUG,Home,Kitchen
21874,GIN AND TONIC MUG,Home,Kitchen
21875,KINGS CHOICE MUG,Home,Kitchen
21876,POTTERING MUG,Home,Kitchen
21877,HOME SWEET HOME MUG,Home,Kitchen
21878,PACK OF 6 SANDCASTLE FLAGS ASSORTED,Air fragances,Candles
21879,HEARTS GIFT TAPE,Stationery,Desktop Stationery
21880,RED RETROSPOT TAPE,Stationery,Desktop Stationery
21881,CUTE CATS TAPE,Stationery,Desktop Stationery
21882,SKULLS TAPE,Stationery,Desktop Stationery
21883,STARS GIFT TAPE ,Stationery,Desktop Stationery
21884,CAKES AND BOWS GIFT  TAPE,Stationery,Desktop Stationery
21888,BINGO SET,Kids,Toys
21889,WOODEN BOX OF DOMINOES,Kids,Toys
21890,S/6 WOODEN SKITTLES IN COTTON BAG,Accessories,Bags
21892,TRADITIONAL WOODEN CATCH CUP GAME ,Home,Kitchen
21895,POTTING SHED SOW 'N' GROW SET,Hobbies,Garden
21896,POTTING SHED TWINE,Home,Kitchen
21897,POTTING SHED CANDLE CITRONELLA,Air fragances,Candles
21898,POTTING SHED ROSE CANDLE,Air fragances,Candles
21903,MAN FLU METAL SIGN,Home,Decoration
21904,HOUSE WRECKING METAL SIGN ,Home,Decoration
21905,MORE BUTTER METAL SIGN ,Home,Decoration
21907,I'M ON HOLIDAY METAL SIGN,Home,Decoration
21908,CHOCOLATE THIS WAY METAL SIGN,Home,Decoration
21910,WAY OUT METAL SIGN ,Home,Decoration
21911,GARDEN METAL SIGN ,Home,Decoration
21925,UNION STRIPE CUSHION COVER ,Home,Furniture
21926,RED/CREAM STRIPE CUSHION COVER ,Home,Furniture
21927,BLUE/CREAM STRIPE CUSHION COVER ,Home,Furniture
21928,JUMBO BAG SCANDINAVIAN PAISLEY,Accessories,Bags
21929,JUMBO BAG PINK VINTAGE PAISLEY,Accessories,Bags
21930,JUMBO STORAGE BAG SKULLS,Accessories,Bags
21931,JUMBO STORAGE BAG SUKI,Accessories,Bags
21932,SCANDINAVIAN PAISLEY PICNIC BAG,Accessories,Bags
21933,PINK VINTAGE PAISLEY PICNIC BAG,Accessories,Bags
21934,SKULL SHOULDER BAG,Accessories,Bags
21935,SUKI  SHOULDER BAG,Accessories,Bags
21936,RED RETROSPOT PICNIC BAG,Accessories,Bags
21937,STRAWBERRY   PICNIC BAG,Accessories,Bags
21943,CAKES AND RABBITS DESIGN FLANNEL ,Kids,Toys
21946,PARTY TIME DESIGN FLANNEL,Kids,Party
21948,SET OF 6 CAKE CHOPSTICKS,Home,Kitchen
21955,DOORMAT UNION JACK GUNS AND ROSES,Home,Furniture
21967,PACK OF 12 SKULL TISSUES,Home,Paper
21973,SET OF 36 MUSHROOM PAPER DOILIES,Home,Furniture
21975,PACK OF 60 DINOSAUR CAKE CASES,Home,Kitchen
21976,PACK OF 60 MUSHROOM CAKE CASES,Home,Kitchen
21977,PACK OF 60 PINK PAISLEY CAKE CASES,Home,Kitchen
21980,PACK OF 12 RED SPOTTY TISSUES ,Home,Paper
21981,PACK OF 12 WOODLAND TISSUES ,Home,Paper
21982,PACK OF 12 SUKI TISSUES ,Home,Paper
21983,PACK OF 12 BLUE PAISLEY TISSUES ,Home,Paper
21984,PACK OF 12 PINK PAISLEY TISSUES ,Home,Paper
21985,PACK OF 12 HEARTS DESIGN TISSUES ,Home,Paper
21986,PACK OF 12 PINK SPOT TISSUES ,Home,Paper
21987,PACK OF 6 SKULL PAPER CUPS,Kids,Party
21988,PACK OF 6 SKULL PAPER PLATES,Kids,Party
21989,PACK OF 20 SKULL PAPER NAPKINS,Home,Paper
21990,MODERN FLORAL STATIONERY SET,Stationery,Desktop Stationery
21991,BOHEMIAN COLLAGE STATIONERY SET,Stationery,Desktop Stationery
21992,VINTAGE PAISLEY STATIONERY SET,Stationery,Desktop Stationery
21993,FLORAL FOLK STATIONERY SET,Stationery,Desktop Stationery
22016,Dotcomgiftshop Gift Voucher 100.00,Others,Vouchers
22021,BLUE FELT EASTER EGG BASKET,Seasonal,Easter
22023,EMPIRE BIRTHDAY CARD,Stationery,Gifts
22024,RAINY LADIES BIRTHDAY CARD,Stationery,Gifts
22025,RING OF ROSES BIRTHDAY CARD,Stationery,Gifts
22026,BANQUET BIRTHDAY  CARD  ,Stationery,Gifts
22027,TEA PARTY BIRTHDAY CARD,Home,Kitchen
22028,PENNY FARTHING BIRTHDAY CARD,Stationery,Desktop Stationery
22029,SPACEBOY BIRTHDAY CARD,Stationery,Gifts
22030,SWALLOWS GREETING CARD,Stationery,Gifts
22031,BOTANICAL LAVENDER BIRTHDAY CARD,Stationery,Gifts
22032,BOTANICAL LILY GREETING CARD,Stationery,Gifts
22033,BOTANICAL ROSE GREETING CARD,Stationery,Gifts
22034,ROBIN CHRISTMAS CARD,Seasonal,Christmas
22035,VINTAGE CARAVAN GREETING CARD ,Stationery,Gifts
22036,DINOSAUR BIRTHDAY CARD,Stationery,Gifts
22037,ROBOT BIRTHDAY CARD,Stationery,Gifts
22038,BOTANICAL LAVENDER GIFT WRAP ,Stationery,Gifts
22039,BOTANICAL LILY GIFT WRAP,Stationery,Gifts
22040,BOTANICAL ROSE GIFT WRAP,Stationery,Gifts
22041,"RECORD FRAME 7"" SINGLE SIZE ",Hobbies,Photo
22042,CHRISTMAS CARD SINGING ANGEL,Seasonal,Christmas
22043,CHRISTMAS CARD SCREEN PRINT ,Seasonal,Christmas
22044,CHRISTMAS CARD STACK OF PRESENTS,Seasonal,Christmas
22045,SPACEBOY GIFT WRAP,Stationery,Gifts
22046,TEA PARTY  WRAPPING PAPER ,Stationery,Gifts
22047,EMPIRE GIFT WRAP,Stationery,Gifts
22048,BIRTHDAY BANQUET GIFT WRAP,Stationery,Gifts
22049,WRAP CHRISTMAS SCREEN PRINT,Stationery,Gifts
22050,PINK PAISLEY ROSE GIFT WRAP,Stationery,Gifts
22051,BLUE SCANDINAVIAN PAISLEY WRAP,Stationery,Gifts
22052,VINTAGE CARAVAN GIFT WRAP,Stationery,Gifts
22054,MINI CAKE STAND HANGING HEARTS,Home,Kitchen
22055,MINI CAKE STAND  HANGING STRAWBERY,Home,Kitchen
22058,CERAMIC LOVE HEARTS DESIGN MUG,Home,Kitchen
22059,CERAMIC STRWBERRY DESIGN MUG,Home,Kitchen
22060,LARGE CAKE STAND HANGING HEARTS,Home,Kitchen
22061,LARGE CAKE STAND  HANGING STRAWBERY,Home,Kitchen
22062,CERAMIC BOWL WITH LOVE HEART DESIGN,Home,Furniture
22063,CERAMIC BOWL WITH STRAWBERRY DESIGN,Home,Furniture
22064,PINK DOUGHNUT TRINKET POT ,Accessories,Bijoux
22065,CHRISTMAS PUDDING TRINKET POT ,Seasonal,Christmas
22066,LOVE HEART TRINKET POT,Accessories,Bijoux
22067,CHOC TRUFFLE GOLD TRINKET POT ,Accessories,Bijoux
22068,BLACK PIRATE TREASURE CHEST,Home,Furniture
22069,BROWN  PIRATE TREASURE CHEST ,Home,Furniture
22070,SMALL RED RETROSPOT MUG IN BOX ,Home,Kitchen
22071,SMALL WHITE RETROSPOT MUG IN BOX ,Home,Kitchen
22072,RED RETROSPOT TEA CUP AND SAUCER ,Home,Kitchen
22073,RED RETROSPOT STORAGE JAR,Home,Kitchen
22074,6 RIBBONS SHIMMERING PINKS ,Stationery,Gifts
22075,6 RIBBONS ELEGANT CHRISTMAS ,Seasonal,Christmas
22076,6 RIBBONS EMPIRE  ,Stationery,Gifts
22077,6 RIBBONS RUSTIC CHARM,Stationery,Gifts
22078,RIBBON REEL LACE DESIGN ,Stationery,Gifts
22079,RIBBON REEL HEARTS DESIGN ,Stationery,Gifts
22080,RIBBON REEL SPOTS DESIGN ,Stationery,Gifts
22081,RIBBON REEL FLORA + FAUNA ,Stationery,Gifts
22082,RIBBON REEL STRIPES DESIGN ,Stationery,Gifts
22083,PAPER CHAIN KIT RETRO SPOT,Stationery,Gifts
22084,PAPER CHAIN KIT EMPIRE,Stationery,Gifts
22085,PAPER CHAIN KIT SKULLS ,Stationery,Gifts
22086,PAPER CHAIN KIT 50'S CHRISTMAS ,Seasonal,Christmas
22087,PAPER BUNTING WHITE LACE,Kids,Party
22088,PAPER BUNTING COLOURED LACE,Kids,Party
22089,PAPER BUNTING VINTAGE PAISLEY,Kids,Party
22090,PAPER BUNTING RETROSPOT,Kids,Party
22101,MIRROR MOSAIC VOTIVE HOLDER,Home,Bathroom
22102,MIRROR MOSAIC T-LIGHT HOLDER ,Air fragances,Candles
22103,MIRROR MOSAIC T-LIGHT HOLDER ROUND,Air fragances,Candles
22104,MIRROR MOSAIC CANDLE PLATE,Air fragances,Candles
22105,MIRROR MOSAIC GOBLET CANDLE HOLDER,Air fragances,Candles
22106,MIRROR MOSAIC HURRICANE LAMP ,Home,Bathroom
22109,FULL ENGLISH BREAKFAST PLATE,Home,Kitchen
22110,BIRD HOUSE HOT WATER BOTTLE,Home,Kitchen
22111,SCOTTIE DOG HOT WATER BOTTLE,Home,Kitchen
22112,CHOCOLATE HOT WATER BOTTLE,Home,Kitchen
22113,GREY HEART HOT WATER BOTTLE,Home,Kitchen
22114,HOT WATER BOTTLE TEA AND SYMPATHY,Home,Kitchen
22115,METAL SIGN EMPIRE TEA,Home,Kitchen
22116,METAL SIGN HIS DINNER IS SERVED,Home,Decoration
22117,METAL SIGN HER DINNER IS SERVED ,Home,Decoration
22118,JOY WOODEN BLOCK LETTERS,Stationery,Notebooks
22119,PEACE WOODEN BLOCK LETTERS,Stationery,Notebooks
22120,WELCOME  WOODEN BLOCK LETTERS,Stationery,Notebooks
22121,NOEL WOODEN BLOCK LETTERS ,Stationery,Notebooks
22122,SET OF 2 FANCY FONT TEA TOWELS,Home,Kitchen
22123,PING MICROWAVE APRON,Home,Kitchen
22124,SET OF 2 TEA TOWELS PING MICROWAVE,Home,Kitchen
22125,UNION JACK HOT WATER BOTTLE ,Home,Kitchen
22127,PARTY CONES CARNIVAL ASSORTED,Kids,Party
22128,PARTY CONES CANDY ASSORTED,Kids,Party
22129,PARTY CONES CANDY TREE DECORATION,Kids,Party
22130,PARTY CONE CHRISTMAS DECORATION ,Seasonal,Christmas
22132,RED LOVE HEART SHAPE CUP,Home,Kitchen
22133,PINK LOVE HEART SHAPE CUP,Home,Kitchen
22136,LOVE HEART SOCK HANGER,Home,Furniture
22137,BATHROOM SET LOVE HEART DESIGN,Home,Bathroom
22138,BAKING SET 9 PIECE RETROSPOT ,Home,Kitchen
22139,RETROSPOT TEA SET CERAMIC 11 PC ,Home,Kitchen
22141,CHRISTMAS CRAFT TREE TOP ANGEL,Seasonal,Christmas
22142,CHRISTMAS CRAFT WHITE FAIRY ,Seasonal,Christmas
22143,CHRISTMAS CRAFT HEART DECORATIONS,Seasonal,Christmas
22144,CHRISTMAS CRAFT LITTLE FRIENDS,Seasonal,Christmas
22145,CHRISTMAS CRAFT HEART STOCKING ,Seasonal,Christmas
22146,EASTER CRAFT IVY WREATH WITH CHICK,Seasonal,Easter
22148,EASTER CRAFT 4 CHICKS ,Seasonal,Easter
22151,PLACE SETTING WHITE HEART,Home,Kitchen
22152,PLACE SETTING WHITE STAR,Home,Kitchen
22153,ANGEL DECORATION STARS ON DRESS,Home,Decoration
22154,ANGEL DECORATION 3 BUTTONS ,Home,Decoration
22155,STAR DECORATION RUSTIC,Home,Decoration
22156,HEART DECORATION WITH PEARLS ,Home,Decoration
22157,ANGEL DECORATION WITH LACE PADDED,Home,Decoration
22158,3 HEARTS HANGING DECORATION RUSTIC,Home,Decoration
22161,HEART DECORATION RUSTIC HANGING ,Home,Decoration
22162,HEART GARLAND RUSTIC PADDED,Kids,Party
22163,HEART STRING MEMO HOLDER HANGING,Stationery,Notebooks
22164,STRING OF STARS CARD HOLDER,Stationery,Gifts
22165,"DIAMANTE HEART SHAPED WALL MIRROR, ",Home,Bathroom
22166,"WALL MIRROR , RECT DIAMANTE, PINK/",Home,Bathroom
22167,"WALL MIRROR , DIAMANTE OVAL SHAPE",Home,Bathroom
22168,ORGANISER WOOD ANTIQUE WHITE ,Home,Furniture
22169,FAMILY ALBUM WHITE PICTURE FRAME,Hobbies,Photo
22170,PICTURE FRAME WOOD TRIPLE PORTRAIT,Hobbies,Photo
22171,3 HOOK PHOTO SHELF ANTIQUE WHITE,Home,Furniture
22172,METAL SHELF WITH RAIL ,Home,Furniture
22173,METAL 4 HOOK HANGER FRENCH CHATEAU,Home,Kitchen
22175,PINK OWL SOFT TOY,Kids,Toys
22176,BLUE OWL SOFT TOY,Kids,Toys
22177,5 HOOK BLACKBOARD ORGANISER ,Home,Furniture
22178,VICTORIAN GLASS HANGING T-LIGHT,Air fragances,Candles
22179,SET 10 LIGHTS NIGHT OWL,Kids,Toys
22180,RETROSPOT LAMP,Home,Furniture
22181,SNOWSTORM PHOTO FRAME FRIDGE MAGNET,Home,Kitchen
22182,CAKE STAND VICTORIAN FILIGREE SMALL,Home,Kitchen
22183,CAKE STAND VICTORIAN FILIGREE MED,Home,Kitchen
22184,CAKE STAND VICTORIAN FILIGREE LARGE,Home,Kitchen
22186,RED STAR CARD HOLDER,Stationery,Gifts
22187,GREEN CHRISTMAS TREE CARD HOLDER,Seasonal,Christmas
22188,BLACK HEART CARD HOLDER,Stationery,Gifts
22189,CREAM HEART CARD HOLDER,Stationery,Gifts
22190,LOCAL CAFE MUG,Home,Kitchen
22191,IVORY DINER WALL CLOCK,Home,Clocks
22192,BLUE DINER WALL CLOCK,Home,Clocks
22193,RED DINER WALL CLOCK,Home,Clocks
22194,BLACK DINER WALL CLOCK,Home,Clocks
22195,LARGE HEART MEASURING SPOONS,Home,Kitchen
22196,SMALL HEART MEASURING SPOONS,Home,Kitchen
22197,SMALL POPCORN HOLDER,Home,Kitchen
22198,LARGE POPCORN HOLDER ,Home,Kitchen
22199,FRYING PAN RED POLKADOT ,Home,Kitchen
22200,FRYING PAN PINK POLKADOT ,Home,Kitchen
22201,FRYING PAN BLUE POLKADOT ,Home,Kitchen
22206,"MUG , DOTCOMGIFTSHOP.COM ",Home,Kitchen
22207,FRYING PAN UNION FLAG,Home,Kitchen
22208,WOOD STAMP SET THANK YOU,Hobbies,Crafts
22209,WOOD STAMP SET HAPPY BIRTHDAY,Stationery,Gifts
22210,WOOD STAMP SET BEST WISHES,Hobbies,Crafts
22211,WOOD STAMP SET FLOWERS,Hobbies,Crafts
22214,CANDLE PLATE LACE WHITE,Air fragances,Candles
22215,CAKE STAND WHITE TWO TIER LACE,Home,Kitchen
22216,T-LIGHT HOLDER WHITE LACE,Air fragances,Candles
22217,T-LIGHT HOLDER HANGING LACE,Air fragances,Candles
22218,CAKE STAND LACE WHITE,Home,Kitchen
22219,LOVEBIRD HANGING DECORATION WHITE ,Home,Decoration
22220,CAKE STAND LOVEBIRD 2 TIER WHITE,Home,Kitchen
22221,CAKE STAND LOVEBIRD 2 TIER PINK,Home,Kitchen
22222,CAKE PLATE LOVEBIRD WHITE,Home,Kitchen
22223,CAKE PLATE LOVEBIRD PINK,Home,Kitchen
22224,WHITE LOVEBIRD LANTERN,Air fragances,Candles
22227,HANGING HEART MIRROR DECORATION ,Home,Bathroom
22230,JIGSAW TREE WITH WATERING CAN,Hobbies,Garden
22231,JIGSAW TREE WITH BIRDHOUSE,Home,Pets
22232,JIGSAW TOADSTOOLS 3 PIECE,Home,Furniture
22233,JIGSAW RABBIT AND BIRDHOUSE,Kids,Toys
22236,CAKE STAND 3 TIER MAGIC GARDEN,Home,Kitchen
22241,GARLAND WOODEN HAPPY EASTER,Seasonal,Easter
22242,"HOOK, 5 HANGER , MAGIC TOADSTOOL",Home,Furniture
22243,5 HOOK HANGER RED MAGIC TOADSTOOL,Home,Furniture
22244,3 HOOK HANGER MAGIC GARDEN,Home,Furniture
22245,"HOOK, 1 HANGER ,MAGIC GARDEN",Home,Furniture
22246,"GARLAND, MAGIC GARDEN 1.8M",Kids,Party
22247,BUNNY DECORATION MAGIC GARDEN,Hobbies,Garden
22248,DECORATION  PINK CHICK MAGIC GARDEN,Hobbies,Garden
22249,DECORATION WHITE CHICK MAGIC GARDEN,Hobbies,Garden
22250,DECORATION  BUTTERFLY  MAGIC GARDEN,Hobbies,Garden
22251,BIRDHOUSE DECORATION MAGIC GARDEN,Home,Pets
22252,BIRDCAGE DECORATION TEALIGHT HOLDER,Home,Kitchen
22254,FELT TOADSTOOL LARGE,Home,Furniture
22255,FELT TOADSTOOL  SMALL,Home,Furniture
22258,FELT FARM ANIMAL RABBIT,Kids,Toys
22260,FELT EGG COSY BLUE RABBIT ,Kids,Toys
22261,FELT EGG COSY WHITE RABBIT ,Kids,Toys
22265,EASTER DECORATION NATURAL CHICK,Seasonal,Easter
22266,EASTER DECORATION HANGING BUNNY,Seasonal,Easter
22267,EASTER DECORATION EGG BUNNY ,Seasonal,Easter
22268,EASTER DECORATION SITTING BUNNY,Seasonal,Easter
22269,EGG CUP NATURAL CHICKEN,Home,Kitchen
22270,HAPPY EASTER HANGING DECORATION,Seasonal,Easter
22275,WEEKEND BAG VINTAGE ROSE PAISLEY,Accessories,Bags
22276,WASH BAG VINTAGE ROSE PAISLEY,Accessories,Bags
22277,COSMETIC BAG VINTAGE ROSE PAISLEY,Accessories,Bags
22278,OVERNIGHT BAG VINTAGE ROSE PAISLEY,Accessories,Bags
22279,POCKET BAG BLUE PAISLEY RED SPOT,Accessories,Bags
22280,POCKET BAG PINK PAISELY BROWN SPOT,Accessories,Bags
22281,EASTER TREE YELLOW BIRDS,Seasonal,Easter
22284,HEN HOUSE DECORATION,Home,Decoration
22285,"DECORATION HEN ON NEST, HANGING",Home,Decoration
22286,"DECORATION , WOBBLY RABBIT , METAL ",Kids,Toys
22287,"DECORATION , WOBBLY CHICKEN, METAL ",Home,Decoration
22288,"DECORATION , HANGING METAL RABBIT",Kids,Toys
22289,"DECORATION , HANGING METAL CHICKEN",Home,Decoration
22290,STANDING METAL RABBIT WITH EGG,Kids,Toys
22299,PIG KEYRING WITH LIGHT & SOUND ,Accessories,Bijoux
22300,COFFEE MUG DOG + BALL DESIGN,Home,Kitchen
22301,COFFEE MUG CAT + BIRD DESIGN,Home,Kitchen
22302,COFFEE MUG PEARS  DESIGN,Home,Kitchen
22303,COFFEE MUG APPLES DESIGN,Home,Kitchen
22304,COFFEE MUG BLUE PAISLEY DESIGN,Home,Kitchen
22305,COFFEE MUG PINK PAISLEY DESIGN,Home,Kitchen
22306,SILVER MUG BONE CHINA TREE OF LIFE,Home,Kitchen
22307,GOLD MUG BONE CHINA TREE OF LIFE,Home,Kitchen
22308,TEA COSY BLUE STRIPE,Home,Kitchen
22309,TEA COSY RED  STRIPE,Home,Kitchen
22310,IVORY KNITTED MUG COSY ,Home,Kitchen
22311,OFFICE MUG WARMER BLACK+SILVER ,Home,Kitchen
22312,OFFICE MUG WARMER POLKADOT,Home,Kitchen
22313,OFFICE MUG WARMER PINK,Home,Kitchen
22314,OFFICE MUG WARMER CHOC+BLUE,Home,Kitchen
22317,FIVE CATS HANGING DECORATION,Home,Decoration
22318,FIVE HEART HANGING DECORATION,Home,Decoration
22319,HAIRCLIPS FORTIES FABRIC ASSORTED,Accessories,Bijoux
22321,BIRD DECORATION RED RETROSPOT,Home,Decoration
22322,BIRD DECORATION GREEN POLKADOT,Home,Decoration
22323,PINK POLKADOT KIDS BAG,Accessories,Bags
22324,BLUE POLKADOT KIDS BAG,Accessories,Bags
22326,ROUND SNACK BOXES SET OF4 WOODLAND ,Home,Kitchen
22327,ROUND SNACK BOXES SET OF 4 SKULLS,Home,Kitchen
22328,ROUND SNACK BOXES SET OF 4 FRUITS ,Home,Kitchen
22331,WOODLAND PARTY BAG + STICKER SET,Accessories,Bags
22332,SKULLS PARTY BAG + STICKER SET,Accessories,Bags
22333,RETROSPOT PARTY BAG + STICKER SET,Accessories,Bags
22334,DINOSAUR PARTY BAG + STICKER SET,Accessories,Bags
22335,HEART DECORATION PAINTED ZINC ,Home,Decoration
22336,DOVE DECORATION PAINTED ZINC ,Home,Decoration
22337,ANGEL DECORATION PAINTED ZINC ,Home,Decoration
22338,STAR DECORATION PAINTED ZINC ,Home,Decoration
22339,CHRISTMAS TREE PAINTED ZINC ,Seasonal,Christmas
22340,NOEL GARLAND PAINTED ZINC ,Kids,Party
22341,LOVE GARLAND PAINTED ZINC ,Kids,Party
22342,HOME GARLAND PAINTED ZINC ,Kids,Party
22343,PARTY PIZZA DISH RED RETROSPOT,Home,Kitchen
22344,PARTY PIZZA DISH PINK POLKADOT,Home,Kitchen
22345,PARTY PIZZA DISH BLUE POLKADOT,Home,Kitchen
22346,PARTY PIZZA DISH GREEN POLKADOT,Home,Kitchen
22347,PIZZA SLICE DISH,Home,Kitchen
22348,TEA BAG PLATE RED SPOTTY ,Accessories,Bags
22349,DOG BOWL CHASING BALL DESIGN,Home,Furniture
22350,ILLUSTRATED CAT BOWL ,Home,Furniture
22351,DOTCOMGIFTSHOP TEA TOWEL,Home,Kitchen
22352,LUNCH BOX WITH CUTLERY RETROSPOT ,Home,Kitchen
22353,LUNCH BOX WITH CUTLERY FAIRY CAKES ,Home,Kitchen
22354,RETROSPOT PADDED SEAT CUSHION,Home,Furniture
22355,CHARLOTTE BAG SUKI DESIGN,Accessories,Bags
22356,CHARLOTTE BAG PINK POLKADOT,Accessories,Bags
22357,KINGS CHOICE BISCUIT TIN,Home,Kitchen
22358,KINGS CHOICE TEA CADDY ,Home,Kitchen
22359,GLASS JAR KINGS CHOICE,Home,Kitchen
22360,GLASS JAR ENGLISH CONFECTIONERY,Home,Kitchen
22361,GLASS JAR DAISY FRESH COTTON WOOL,Home,Kitchen
22362,GLASS JAR PEACOCK BATH SALTS,Home,Kitchen
22363,GLASS JAR MARMALADE ,Home,Kitchen
22364,GLASS JAR DIGESTIVE BISCUITS,Home,Kitchen
22365,DOORMAT RESPECTABLE HOUSE,Home,Furniture
22366,DOORMAT AIRMAIL ,Home,Furniture
22367,CHILDRENS APRON SPACEBOY DESIGN,Kids,Toys
22371,AIRLINE BAG VINTAGE TOKYO 78,Accessories,Bags
22372,AIRLINE BAG VINTAGE WORLD CHAMPION ,Accessories,Bags
22374,AIRLINE BAG VINTAGE JET SET RED,Accessories,Bags
22375,AIRLINE BAG VINTAGE JET SET BROWN,Accessories,Bags
22376,AIRLINE BAG VINTAGE JET SET WHITE,Accessories,Bags
22377,BOTTLE BAG RETROSPOT ,Accessories,Bags
22379,RECYCLING BAG RETROSPOT ,Accessories,Bags
22380,TOY TIDY SPACEBOY  ,Kids,Toys
22381,TOY TIDY PINK POLKADOT,Kids,Toys
22382,LUNCH BAG SPACEBOY DESIGN ,Accessories,Bags
22383,LUNCH BAG SUKI  DESIGN ,Accessories,Bags
22384,LUNCH BAG PINK POLKADOT,Accessories,Bags
22385,JUMBO BAG SPACEBOY DESIGN,Accessories,Bags
22386,JUMBO BAG PINK POLKADOT,Accessories,Bags
22389,PAPERWEIGHT SAVE THE PLANET,Stationery,Desktop Stationery
22390,PAPERWEIGHT CHILDHOOD MEMORIES,Stationery,Notebooks
22391,PAPERWEIGHT HOME SWEET HOME,Stationery,Desktop Stationery
22393,PAPERWEIGHT VINTAGE COLLAGE,Stationery,Desktop Stationery
22394,PAPERWEIGHT KINGS CHOICE ,Stationery,Desktop Stationery
22395,PAPERWEIGHT VINTAGE PAISLEY,Stationery,Desktop Stationery
22399,MAGNETS PACK OF 4 CHILDHOOD MEMORY,Stationery,Notebooks
22409,MONEY BOX BISCUITS DESIGN,Home,Kitchen
22411,JUMBO SHOPPER VINTAGE RED PAISLEY,Accessories,Bags
22412,METAL SIGN NEIGHBOURHOOD WITCH ,Home,Decoration
22413,METAL SIGN TAKE IT OR LEAVE IT ,Home,Decoration
22414,DOORMAT NEIGHBOURHOOD WITCH ,Home,Furniture
22416,SET OF 36 DOILIES SPACEBOY DESIGN ,Kids,Toys
22417,PACK OF 60 SPACEBOY CAKE CASES,Kids,Toys
22418,10 COLOUR SPACEBOY PEN,Stationery,Desktop Stationery
22419,LIPSTICK PEN RED,Stationery,Desktop Stationery
22420,LIPSTICK PEN BABY PINK,Stationery,Desktop Stationery
22421,LIPSTICK PEN FUSCHIA,Stationery,Desktop Stationery
22422,TOOTHPASTE TUBE PEN,Stationery,Desktop Stationery
22423,REGENCY CAKESTAND 3 TIER,Home,Kitchen
22426,ENAMEL WASH BOWL CREAM,Home,Furniture
22427,ENAMEL FLOWER JUG CREAM,Home,Kitchen
22429,ENAMEL MEASURING JUG CREAM,Home,Kitchen
22430,ENAMEL WATERING CAN CREAM,Hobbies,Garden
22431,WATERING CAN BLUE ELEPHANT,Hobbies,Garden
22432,WATERING CAN PINK BUNNY,Hobbies,Garden
22433,WATERING CAN GREEN DINOSAUR,Hobbies,Garden
22436,12 COLOURED PARTY BALLOONS,Kids,Party
22441,GROW YOUR OWN BASIL IN ENAMEL MUG,Home,Kitchen
22442,GROW YOUR OWN FLOWERS SET OF 3,Hobbies,Garden
22443,GROW YOUR OWN HERBS SET OF 3,Hobbies,Garden
22444,GROW YOUR OWN PLANT IN A CAN ,Hobbies,Garden
22445,PENCIL CASE LIFE IS BEAUTIFUL,Stationery,Desktop Stationery
22446,PIN CUSHION BABUSHKA PINK,Home,Furniture
22447,PIN CUSHION BABUSHKA BLUE,Home,Furniture
22448,PIN CUSHION RUSSIAN DOLL RED,Home,Furniture
22449,SILK PURSE BABUSHKA PINK,Accessories,Bags
22450,SILK PURSE BABUSHKA BLUE,Accessories,Bags
22451,SILK PURSE BABUSHKA RED,Accessories,Bags
22452,MEASURING TAPE BABUSHKA PINK,Stationery,Desktop Stationery
22453,MEASURING TAPE BABUSHKA BLUE,Stationery,Desktop Stationery
22454,MEASURING TAPE BABUSHKA RED,Stationery,Desktop Stationery
22456,NATURAL SLATE CHALKBOARD LARGE ,Home,Furniture
22457,NATURAL SLATE HEART CHALKBOARD ,Home,Furniture
22458,CAST IRON HOOK GARDEN FORK,Hobbies,Garden
22459,CAST IRON HOOK GARDEN TROWEL,Hobbies,Garden
22460,EMBOSSED GLASS TEALIGHT HOLDER,Home,Kitchen
22461,SAVOY ART DECO CLOCK,Home,Clocks
22464,HANGING METAL HEART LANTERN,Air fragances,Candles
22465,HANGING METAL STAR LANTERN,Air fragances,Candles
22468,BABUSHKA LIGHTS STRING OF 10,Home,Furniture
22469,HEART OF WICKER SMALL,Home,Furniture
22470,HEART OF WICKER LARGE,Home,Furniture
22472,TV DINNER TRAY DOLLY GIRL,Kids,Toys
22474,SPACEBOY TV DINNER TRAY,Kids,Toys
22477,WATERING CAN GARDEN MARKER,Hobbies,Garden
22478,BIRDHOUSE GARDEN MARKER ,Home,Pets
22479,DAISY GARDEN MARKER,Hobbies,Garden
22480,RED TEA TOWEL CLASSIC DESIGN,Home,Kitchen
22481,BLACK TEA TOWEL CLASSIC DESIGN,Home,Kitchen
22482,BLUE TEA TOWEL CLASSIC DESIGN,Home,Kitchen
22483,RED GINGHAM TEDDY BEAR ,Kids,Toys
22486,PLASMATRONIC LAMP,Home,Furniture
22487,WHITE WOOD GARDEN PLANT LADDER,Hobbies,Garden
22488,NATURAL SLATE RECTANGLE CHALKBOARD,Home,Furniture
22491,PACK OF 12 COLOURED PENCILS,Stationery,Desktop Stationery
22497,SET OF 2 TINS VINTAGE BATHROOM ,Home,Bathroom
22498,WOODEN REGATTA BUNTING,Kids,Party
22499,WOODEN UNION JACK BUNTING,Kids,Party
22500,SET OF 2 TINS JARDIN DE PROVENCE,Home,Kitchen
22501,PICNIC BASKET WICKER LARGE,Hobbies,Garden
22502,PICNIC BASKET WICKER 60 PIECES,Hobbies,Garden
22503,CABIN BAG VINTAGE PAISLEY,Accessories,Bags
22504,CABIN BAG VINTAGE RETROSPOT,Accessories,Bags
22505,MEMO BOARD COTTAGE DESIGN,Stationery,Notebooks
22507,MEMO BOARD RETROSPOT  DESIGN,Stationery,Notebooks
22508,DOORSTOP RETROSPOT HEART,Home,Furniture
22509,SEWING BOX RETROSPOT DESIGN ,Hobbies,Crafts
22510,GINGHAM BABUSHKA DOORSTOP,Home,Furniture
22511,RETROSPOT BABUSHKA DOORSTOP,Home,Furniture
22512,DOORSTOP RACING CAR DESIGN,Home,Furniture
22513,DOORSTOP FOOTBALL DESIGN,Home,Furniture
22514,CHILDS GARDEN SPADE BLUE,Hobbies,Garden
22515,CHILDS GARDEN SPADE PINK,Hobbies,Garden
22516,CHILDS GARDEN RAKE BLUE,Hobbies,Garden
22517,CHILDS GARDEN RAKE PINK,Hobbies,Garden
22518,CHILDS GARDEN BRUSH BLUE,Hobbies,Garden
22519,CHILDS GARDEN BRUSH PINK,Hobbies,Garden
22520,CHILDS GARDEN TROWEL BLUE ,Hobbies,Garden
22521,CHILDS GARDEN TROWEL PINK,Hobbies,Garden
22522,CHILDS GARDEN FORK BLUE ,Hobbies,Garden
22523,CHILDS GARDEN FORK PINK,Hobbies,Garden
22524,CHILDRENS GARDEN GLOVES BLUE,Hobbies,Garden
22525,CHILDRENS GARDEN GLOVES PINK,Hobbies,Garden
22526,WHEELBARROW FOR CHILDREN ,Hobbies,Garden
22528,GARDENERS KNEELING PAD,Hobbies,Garden
22530,MAGIC DRAWING SLATE DOLLY GIRL ,Kids,Toys
22532,MAGIC DRAWING SLATE LEAP FROG ,Kids,Toys
22533,MAGIC DRAWING SLATE BAKE A CAKE ,Home,Kitchen
22534,MAGIC DRAWING SLATE SPACEBOY ,Kids,Toys
22539,MINI JIGSAW DOLLY GIRL,Kids,Toys
22541,MINI JIGSAW LEAP FROG,Kids,Toys
22543,MINI JIGSAW BAKE A CAKE ,Home,Kitchen
22544,MINI JIGSAW SPACEBOY,Kids,Toys
22549,PICTURE DOMINOES,Kids,Toys
22551,PLASTERS IN TIN SPACEBOY,Kids,Toys
22560,TRADITIONAL MODELLING CLAY,Hobbies,Crafts
22561,WOODEN SCHOOL COLOURING SET,Stationery,Desktop Stationery
22562,MONSTERS STENCIL CRAFT,Hobbies,Crafts
22563,HAPPY STENCIL CRAFT,Hobbies,Crafts
22564,ALPHABET STENCIL CRAFT,Hobbies,Crafts
22568,FELTCRAFT CUSHION OWL,Home,Furniture
22569,FELTCRAFT CUSHION BUTTERFLY,Home,Furniture
22570,FELTCRAFT CUSHION RABBIT,Home,Furniture
22571,ROCKING HORSE RED CHRISTMAS ,Seasonal,Christmas
22572,ROCKING HORSE GREEN CHRISTMAS ,Seasonal,Christmas
22573,STAR WOODEN CHRISTMAS DECORATION,Seasonal,Christmas
22574,HEART WOODEN CHRISTMAS DECORATION,Seasonal,Christmas
22575,METAL MERRY CHRISTMAS WREATH,Seasonal,Christmas
22576,SWALLOW WOODEN CHRISTMAS DECORATION,Seasonal,Christmas
22577,WOODEN HEART CHRISTMAS SCANDINAVIAN,Seasonal,Christmas
22578,WOODEN STAR CHRISTMAS SCANDINAVIAN,Seasonal,Christmas
22579,WOODEN TREE CHRISTMAS SCANDINAVIAN,Seasonal,Christmas
