StockCode,Description,Category,Subcategory
47369B,BLUE GREEN EMBROIDERY COSMETIC BAG,Accessories,Bags
47420,ASSORTED COLOUR SUCTION CUP HOOK,Home,Kitchen
47422,ASSORTED MONKEY SUCTION CUP HOOK,Home,Kitchen
47502,POLKADOT CUTLERY 24 PCS IN TRAY,Home,Kitchen
47503E,ASS FLORAL PRINT SCISSORS,Stationery,Desktop Stationery
47503G,ASS FLORAL PRINT TAPE MEASURE,Stationery,Desktop Stationery
47503J,SET/3 FLORAL GARDEN TOOLS IN BAG,Accessories,Bags
47504E,ENGLISH ROSE SCISSORS,Stationery,Desktop Stationery
47504G,ENGLISH ROSE TAPE MEASURE,Stationery,Desktop Stationery
47504J,ENGLISH ROSE SET/3 GARDEN TOOLS,Hobbies,Garden
47504K,ENGLISH ROSE GARDEN SECATEURS,Hobbies,Garden
47505,MINATURE COLOURED GARDENING SET,Hobbies,Garden
47518F,ICON PLACEMAT POP ART ELVIS,Home,Furniture
47518f,ICON PLACEMAT POP ART ELVIS,Home,Furniture
47554,S/3 COLOURS FLOCK TEA TOWELS,Home,Kitchen
47556,SET/2 SPOTTY + ROSE TEA TOWELS ,Home,Kitchen
47556B,TEA TIME TEA TOWELS ,Home,Kitchen
47556b,TEA TIME TEA TOWELS ,Home,Kitchen
47559B,TEA TIME OVEN GLOVE,Home,Kitchen
47559b,TEA TIME OVEN GLOVE,Home,Kitchen
47566,PARTY BUNTING,Kids,Party
47566B,TEA TIME PARTY BUNTING,Home,Kitchen
47566b,TEA TIME PARTY BUNTING,Home,Kitchen
47567B,TEA TIME KITCHEN APRON,Home,Kitchen
47567b,TEA TIME KITCHEN APRON,Home,Kitchen
47568,ENGLISH ROSE DESIGN PEG BAG,Accessories,Bags
47570B,TEA TIME TABLE CLOTH,Home,Kitchen
47570b,TEA TIME TABLE CLOTH,Home,Kitchen
47574A,ENGLISH ROSE SCENTED HANGING FLOWER,Air fragances,Candles
47574B,ENGLISH ROSE SCENTED HANGING HEART,Air fragances,Candles
47578A,ENGLISH ROSE SMALL SCENTED FLOWER,Air fragances,Candles
47579,TEA TIME BREAKFAST BASKET,Home,Kitchen
47580,TEA TIME DES TEA COSY,Home,Kitchen
47581B,FAIRY CAKE WICKER PICNIC BASKET ,Home,Kitchen
47583B,SET OF 3 WICKER BASKET TEA AND CAKE,Home,Kitchen
47585A,PINK FAIRY CAKE CUSHION COVER,Home,Furniture
47586A,PINK FAIRY CAKE CUSHION COVER,Home,Furniture
47587A,PINK FAIRY CAKE COASTER,Home,Kitchen
47589,CONGRATULATIONS BUNTING,Kids,Party
47590A,BLUE HAPPY BIRTHDAY BUNTING,Stationery,Gifts
47590B,PINK HAPPY BIRTHDAY BUNTING,Stationery,Gifts
47590a,BLUE HAPPY BIRTHDAY BUNTING,Stationery,Gifts
47590b,PINK HAPPY BIRTHDAY BUNTING,Stationery,Gifts
47591A,CAROUSEL DES CHILD'S APRON,Home,Kitchen
47591B,SCOTTIES CHILDRENS APRON,Home,Kitchen
47591C,BLUE FAIRY CAKE CHILD'S APRON,Home,Kitchen
47591D,PINK FAIRY CAKE CHILDRENS APRON,Home,Kitchen
47591b,SCOTTIES CHILDRENS APRON,Home,Kitchen
47591c,BLUE FAIRY CAKE CHILD'S APRON,Home,Kitchen
47591d,PINK FAIRY CAKE CHILDRENS APRON,Home,Kitchen
47594A,CAROUSEL DESIGN WASHBAG,Accessories,Bags
47594B,SCOTTIES DESIGN WASHBAG,Accessories,Bags
47594a,CAROUSEL DESIGN WASHBAG,Accessories,Bags
47597,NEW ENGLAND TEATOWELS,Home,Kitchen
47599A,PINK PARTY BAGS,Accessories,Bags
47599B,BLUE PARTY BAGS ,Accessories,Bags
48103,DOORMAT KISS MY.......,Home,Furniture
48111,DOORMAT 3 SMILEY CATS,Home,Furniture
48116,DOORMAT MULTICOLOUR STRIPE,Home,Furniture
48129,DOORMAT TOPIARY,Home,Furniture
48138,DOORMAT UNION FLAG,Home,Furniture
48173A,DOOR MAT BLUE FLOCK,Home,Furniture
48173C,DOORMAT BLACK FLOCK ,Home,Furniture
48173c,DOORMAT BLACK FLOCK ,Home,Furniture
48175,DOOR MAT CAMOUFLAGE,Home,Furniture
48179,DOOR MAT SWEET HOME,Home,Furniture
48184,DOORMAT ENGLISH ROSE ,Home,Furniture
48185,DOORMAT FAIRY CAKE,Home,Furniture
48187,DOORMAT NEW ENGLAND,Home,Furniture
48188,DOORMAT WELCOME PUPPIES,Home,Furniture
48189,DOORMAT FRIENDSHIP ,Home,Furniture
48194,DOORMAT HEARTS,Home,Furniture
48195,DOOR MAT GREEN PAISLEY ,Home,Furniture
48197,DOOR MAT BIRD ON THE WIRE,Home,Furniture
51014A,"FEATHER PEN,HOT PINK",Stationery,Desktop Stationery
51014C,"FEATHER PEN,COAL BLACK",Stationery,Desktop Stationery
51014L,"FEATHER PEN,LIGHT PINK",Stationery,Desktop Stationery
51014c,"FEATHER PEN,COAL BLACK",Stationery,Desktop Stationery
62018,SOMBRERO ,Accessories,Garments
62043B,BLUE CHECK BAG W HANDLE 34X20CM,Accessories,Bags
62074B,ELEPHANT CLIP W SUCTION CUP,Home,Kitchen
62086A,PINK RETRO BIG FLOWER BAG,Accessories,Bags
62094B,TURQ ICE CREAM BUM BAG ,Accessories,Bags
62096A,PINK/YELLOW FLOWERS HANDBAG,Accessories,Bags
62096B,PURPLE/TURQ FLOWERS HANDBAG,Accessories,Bags
62097A,PINK STRIPES SHOULDER BAG,Accessories,Bags
62097B,BLUE STRIPES SHOULDER BAG,Accessories,Bags
70007,HI TEC ALPINE HAND WARMER,Accessories,Garments
71028B,SILVER BLUE EGG T-LIGHT HOLDER,Air fragances,Candles
71038,WHITE HANGING BEADS CANDLE HOLDER,Air fragances,Candles
71050,SMALL SINGLE FLAME CANDLE HOLDER,Air fragances,Candles
71053,WHITE METAL LANTERN,Air fragances,Candles
71143,SILVER BOOK MARK WITH BEADS,Stationery,Notebooks
71215,METAL BASE FOR CANDLES,Air fragances,Candles
71279,PINK GLASS CANDLEHOLDER,Air fragances,Candles
71459,HANGING JAM JAR T-LIGHT HOLDER,Air fragances,Candles
71477,COLOUR GLASS. STAR T-LIGHT HOLDER,Air fragances,Candles
71510,SQUARE METAL CANDLEHOLDER BASE,Air fragances,Candles
72008,FROSTED BOX 9 WHITE T-LIGHT CANDLES,Air fragances,Candles
72023F,RED ORGANIC CANDLE IN GLASS,Air fragances,Candles
72024U,LILAC VOTIVE CANDLE,Air fragances,Candles
72038P,PRICE'S CANDLE PEACH,Air fragances,Candles
72045D,ROSES ON BLUE TEACUP CANDLE ,Air fragances,Candles
72051S,BAG OF SILVER STONES,Accessories,Bags
72083A,STRAWBERY SWIRL FLARE CANDLE,Air fragances,Candles
72084B,CHOCOLATE ICE CREAM CANDLE,Air fragances,Candles
72122,COFFEE SCENT PILLAR CANDLE,Air fragances,Candles
72127,COLUMBIAN CANDLE ROUND ,Air fragances,Candles
72128,COLUMBIAN CANDLE ROUND,Air fragances,Candles
72129,COLUMBIAN CANDLE ROUND ,Air fragances,Candles
72130,COLUMBIAN CANDLE ROUND,Air fragances,Candles
72131,COLUMBIAN CANDLE RECTANGLE,Air fragances,Candles
72132,COLUMBIAN CUBE CANDLE,Air fragances,Candles
72133,COLUMBIAN CANDLE RECTANGLE,Air fragances,Candles
72134,COLUMBIAN  CUBE CANDLE ,Air fragances,Candles
72140E,BEST DAD CANDLE LETTERS,Air fragances,Candles
72140F,HAPPY ANNIVERSARY CANDLE LETTERS,Air fragances,Candles
72225C,LAVENDER SCENT CAKE CANDLE,Air fragances,Candles
72225D,VANILLA SCENT CAKE CANDLE ,Air fragances,Candles
72232,FENG SHUI PILLAR CANDLE,Air fragances,Candles
72267,PREMIUM CHURCH CANDLE,Air fragances,Candles
72349B,SET/6 PURPLE BUTTERFLY T-LIGHTS,Air fragances,Candles
72349b,SET/6 PURPLE BUTTERFLY T-LIGHTS,Air fragances,Candles
72351A,SET/6 TURQUOISE BUTTERFLY T-LIGHTS,Air fragances,Candles
72351B,SET/6 PINK  BUTTERFLY T-LIGHTS,Air fragances,Candles
72351a,SET/6 TURQUOISE BUTTERFLY T-LIGHTS,Air fragances,Candles
72369A,PINK CLEAR GLASS CANDLE PLATE,Air fragances,Candles
72484,ROSES IN WHITE HEART CANDLE ,Air fragances,Candles
72487,ROSES WHITE ROUND CANDLE,Air fragances,Candles
72529W,WHITE ADVENT CANDLE,Air fragances,Candles
72529w,WHITE ADVENT CANDLE,Air fragances,Candles
72586,SET OF 6 HALLOWEEN GHOST T-LIGHTS,Air fragances,Candles
72598,SET/12 TAPER CANDLES,Stationery,Desktop Stationery
72606A,BROWN ANTIQUE CUBE CANDLE,Air fragances,Candles
72708,SCULPTED ROUND IVORY CANDLE ,Air fragances,Candles
72709,IVORY SCULPTED RND CANDLE ,Air fragances,Candles
72715,SPHERICAL IVORY CANDLE ,Air fragances,Candles
72724,SET/6 CHRISTMAS ICICLE T-LIGHTS,Air fragances,Candles
72728,ROSE SCENT CANDLES IN GLASS,Air fragances,Candles
72739B,WHITE CHOCOLATE SCENT CANDLE,Air fragances,Candles
72739C,DARK CHOCOLATE SCENTCANDLE,Air fragances,Candles
72740A,LARGE STRAWBERRY CHOCOLATE CANDLE,Air fragances,Candles
72740B,LARGE WHITE CHOCOLATE CANDLE,Air fragances,Candles
72741,GRAND CHOCOLATECANDLE,Air fragances,Candles
72750A,FLOWER FAIRY SET OF 3 LILY CANDLES,Air fragances,Candles
72750B,FLOWER FAIRY SET 3 CANDLES LAVENDER,Air fragances,Candles
72750C,"F.FAIRY S/3 CANDLE/GLASS, ROSE",Air fragances,Candles
72750D,F.FAIRY S/3 CANDLE/GLASS,Air fragances,Candles
72751A,"F.FAIRY S/3 SML CANDLE,LILY/VALLEY",Air fragances,Candles
72751B,"F.FAIRY S/3 SML CANDLE, LAVENDER",Air fragances,Candles
72751C,"F.FAIRY S/3 SML CANDLE, ROSE",Air fragances,Candles
72752A,"F.FAIRY,CANDLE IN GLASS,LILY/VALLEY",Air fragances,Candles
72752B,"F.FAIRY,CANDLE IN GLASS,LAVENDER",Air fragances,Candles
72753A,S/3 FLWR FAIRY LILLY CANDLES,Air fragances,Candles
72753B,S/3 FLWR FAIRY LAVENDER CANDLES,Air fragances,Candles
72753C,S/3 FLWR FAIRY ROSE CANDLES,Air fragances,Candles
72753D,S/3 FLWR FAIRY SUMMER CANDLES,Air fragances,Candles
72754A,FLOWER FAIRY POTPOURRI CUSHION LILY,Home,Furniture
72754B,F FAIRY POTPOURRI CUSHIONS LAVENDER,Home,Furniture
72754D,F FAIRY POTPOURRI CUSHIONS SUMMER,Home,Furniture
72755C,FLOWER FAIRY OIL BURNER SET ROSE,Air fragances,Candles
72755D,FLOWER FAIRY OIL BURNER SET SUMMER,Air fragances,Candles
72756,FAIRY CAKE CANDLES,Air fragances,Candles
72760B,VINTAGE CREAM 3 BASKET CAKE STAND,Home,Kitchen
72771B,BURG FLOCK GOLD CUP/CANDLE ,Air fragances,Candles
72771C,BLACK FLOCK GOLD CANDLE,Air fragances,Candles
72772,SET/4 SCENTED CANDLES IN RAMEKINS,Air fragances,Candles
72779,SET/6 BLACK ROSE T-LIGHT CANDLES,Air fragances,Candles
72780,BLACK SILOUETTE CANDLE PLATE,Air fragances,Candles
72781,BLACK SILOUETTE CANDLE PLATE ,Air fragances,Candles
72783,BLACK SIL'T SQU CANDLE PLATE ,Air fragances,Candles
72785A,S/4 CONTEMPORY PINK ROSEBUD CANDLES,Air fragances,Candles
72785B,S/4 CONTEMPORY RED ROSEBUD CANDLES,Air fragances,Candles
72789,BASKET/8 SCENTED LOVE TOKEN CANDLES,Air fragances,Candles
72793,BLACK BOX MIRROR LANTERN,Air fragances,Candles
72796A,S/3 ENGLISH LAVENDER SQU CANDLE,Air fragances,Candles
72796B,S/3 FRENCH VANILLA SQU CANDLE,Air fragances,Candles
72796C,S/3 ROSE GARDEN SCENT SQU CANDLE,Air fragances,Candles
72798C,SET/4 GARDEN ROSE DINNER CANDLE,Air fragances,Candles
72799A,BLACK PILLAR CANDLE SILVER FLOCK,Air fragances,Candles
72799B,PURPLE PILLAR CANDLE BLACK FLOCK,Air fragances,Candles
72799C,PINK PILLAR CANDLE SILVER FLOCK,Air fragances,Candles
72799D,BLUE PILLAR CANDLE SILVER FLOCK,Air fragances,Candles
72799E,IVORY PILLAR CANDLE SILVER FLOCK,Air fragances,Candles
72799F,IVORY PILLAR CANDLE GOLD FLOCK,Air fragances,Candles
72800A,S/4 BLACK DINNER CANDLE SILVER FLOC,Air fragances,Candles
72800B,S/4 PURPLE DINNER CANDLE BLK FLOCK,Air fragances,Candles
72800C,S/4 PINK DINNER CANDLE SILVER FLOCK,Air fragances,Candles
72800D,S/4 BLUE DINNER CANDLE SILVER FLOCK,Air fragances,Candles
72800E,4 IVORY DINNER CANDLES SILVER FLOCK,Air fragances,Candles
72800F,4 IVORY DINNER CANDLES GOLD FLOCK,Air fragances,Candles
72801C,4 ROSE PINK DINNER CANDLES,Air fragances,Candles
72801D,4 SKY BLUE DINNER CANDLES,Air fragances,Candles
72801E,S/4 FESTIVE GREEN DINNER CANDLES,Air fragances,Candles
72801F,S/4 FESTIVE RED DINNER CANDLES,Air fragances,Candles
72801G,S/4 BURGUNDY WINE DINNER CANDLES,Air fragances,Candles
72801c,4 ROSE PINK DINNER CANDLES,Air fragances,Candles
72801d,4 SKY BLUE DINNER CANDLES,Air fragances,Candles
72801e,S/4 FESTIVE GREEN DINNER CANDLES,Air fragances,Candles
72801g,4 BURGUNDY WINE DINNER CANDLES,Air fragances,Candles
72802A,ROSE SCENT CANDLE IN JEWELLED BOX,Air fragances,Candles
72802B,OCEAN SCENT CANDLE IN JEWELLED BOX,Air fragances,Candles
72802C,VANILLA SCENT CANDLE JEWELLED BOX,Air fragances,Candles
72802a,ROSE SCENT CANDLE IN JEWELLED BOX,Air fragances,Candles
72803A,ROSE SCENT CANDLE JEWELLED DRAWER,Air fragances,Candles
72803B,OCEAN SCENT CANDLE JEWELLED DRAWER,Air fragances,Candles
72803b,OCEAN SCENT CANDLE JEWELLED DRAWER,Air fragances,Candles
72805,VANILLA CANDLE IN EMBOSSED ZINC POT,Air fragances,Candles
72807A,SET/3 ROSE CANDLE IN JEWELLED BOX,Air fragances,Candles
72807B,SET/3 OCEAN SCENT CANDLE JEWEL BOX,Air fragances,Candles
72807C,SET/3 VANILLA SCENTED CANDLE IN BOX,Air fragances,Candles
72807a,SET/3 ROSE CANDLE IN JEWELLED BOX,Air fragances,Candles
72807b,SET/3 OCEAN SCENT CANDLE JEWEL BOX,Air fragances,Candles
72807c,SET/3 VANILLA SCENTED CANDLE IN BOX,Air fragances,Candles
72811,SMALL ZINC/GLASS CANDLEHOLDER,Air fragances,Candles
72812,LARGE ZINC GLASS CANDLEHOLDER,Air fragances,Candles
72814,SET OF 3 CHRISTMAS BRIAR CANDLES,Air fragances,Candles
72815,3 WICK CHRISTMAS BRIAR CANDLE ,Air fragances,Candles
72816,SET/3 CHRISTMAS DECOUPAGE CANDLES,Air fragances,Candles
72817,SET OF 2 CHRISTMAS DECOUPAGE CANDLE,Air fragances,Candles
72818,CHRISTMAS DECOUPAGE CANDLE,Air fragances,Candles
72819,CUPID DESIGN SCENTED CANDLES,Air fragances,Candles
72821,CUPID SCENTED CANDLE IN GLASS,Air fragances,Candles
75049L,LARGE CIRCULAR MIRROR MOBILE,Home,Bathroom
78034B,BLUE NETTING STORAGE HANGER,Home,Furniture
79000,MOROCCAN TEA GLASS,Home,Kitchen
79026B,"S/4 ICON COASTER,ELVIS LIVES",Home,Kitchen
79062D,"RETRO TIN ASHTRAY,REVOLUTIONARY",Home,Furniture
79065A,TEATIME ROUND CAKE TINS ,Home,Kitchen
79070b,ENGLISH ROSE SQUARE CAKE TINS,Home,Kitchen
79072,TEATIME CAKE TIN WITH HANDLE,Home,Kitchen
79161A,ST GEORGE SET OF 10 PARTY LIGHTS,Kids,Party
79164,BLACK WINE GLASS,Home,Kitchen
79302M,"ART LIGHTS,FUNK MONKEY",Home,Furniture
79302m,"ART LIGHTS,FUNK MONKEY",Home,Furniture
79303A,WHITE ROHMBIC BLOCK TABLE LAMP,Home,Furniture
79303B,BLUE STAR BLOCK TABLE LAMP,Home,Furniture
79303D,LILAC FLOWER BLOCK TABLE LAMP,Home,Furniture
79308B,MOSAIC CANDLE DISH BLUE PURPLE,Air fragances,Candles
79320,FLAMINGO LIGHTS,Home,Furniture
79321,CHILLI LIGHTS,Home,Furniture
79323B,BLACK CHERRY LIGHTS,Home,Furniture
79323G,GOLD  CHERRY LIGHTS,Home,Furniture
79323GR,GREEN CHERRY LIGHTS,Home,Furniture
79323LP,LIGHT PINK CHERRY LIGHTS,Home,Furniture
79323P,PINK CHERRY LIGHTS,Home,Furniture
79323S, SILVER CHERRY LIGHTS,Home,Furniture
79323W, WHITE CHERRY LIGHTS,Home,Furniture
79328,BLUE FLOCK GLASS CANDLEHOLDER,Air fragances,Candles
79329,PINK FLOCK GLASS CANDLEHOLDER,Air fragances,Candles
79331,PINK FLOCK GLASS CANDLEHOLDER,Air fragances,Candles
79336,LIGHT PINK FLOCK GLASS CANDLEHOLDER,Air fragances,Candles
79337,BLUE FLOCK GLASS CANDLEHOLDER,Air fragances,Candles
79338,DARK PINK FLOCK GLASS CANDLEHOLDER,Air fragances,Candles
79340P,PURPLE ORCHID FLOWER LIGHTS,Home,Furniture
79341,WILLOW BRANCH LIGHTS.,Home,Furniture
79342B,BROWN FLOWER LIGHTS,Home,Furniture
79342b,BROWN FLOWER LIGHTS,Home,Furniture
79413,GLASS WINE GLASS DECORATIONS,Home,Kitchen
79532,MOSAIC GLASS BALL CANDLEHOLDER,Air fragances,Candles
81950B,FLOWER BLUE CLOCK W/SUCKER,Home,Clocks
81950V,FLOWER PURPLE CLOCK W/SUCKER,Home,Clocks
81952B,ROUND BLUE CLOCK W/SUCKER,Home,Clocks
81952V,ROUND PURPLE CLOCK W/SUCKER,Home,Clocks
81953B,ROUND ARTICULATED BLUE CLOCK W/SUCK,Home,Clocks
81953P,ROUND ARTICULATED PINK CLOCK W/SUCK,Home,Clocks
81985A,"ICON ALARM CLOCK,FUSCHIA  PIN UP",Home,Clocks
82001S,VINYL RECORD FRAME SILVER,Hobbies,Photo
82001s,SILVER RECORD COVER FRAME,Hobbies,Photo
82011A,"BATHROOM SCALES, TROPICAL BEACH",Home,Bathroom
82011B,BATHROOM SCALES RUBBER DUCKS,Stationery,Desktop Stationery
82011C,BATHROOM SCALES FOOTPRINTS IN SAND,Air fragances,Candles
82011E,"BATHROOM SCALES, FAG BREAK",Home,Bathroom
82069,BEECH WOOD P/FRAME,Hobbies,Photo
82072,WHITE WOOD SINGLE P/FRAME,Hobbies,Photo
82076,BEECH WOOD PHOTO FRAME ,Hobbies,Photo
82081,PINK HEARTS PHOTO ALBUM,Hobbies,Photo
82093,HEART SHAPE BUTTON FRAME ,Hobbies,Photo
82482,WOODEN PICTURE FRAME WHITE FINISH,Hobbies,Photo
82483,WOOD 2 DRAWER CABINET WHITE FINISH,Home,Furniture
82484,WOOD BLACK BOARD ANT WHITE FINISH,Home,Furniture
82486,WOOD S/3 CABINET ANT WHITE FINISH,Home,Furniture
82494L,WOODEN FRAME ANTIQUE WHITE ,Hobbies,Photo
82494l,WOODEN FRAME ANTIQUE WHITE ,Hobbies,Photo
82551,LAUNDRY 15C METAL SIGN,Home,Decoration
82552,WASHROOM METAL SIGN,Home,Decoration
82553,POP'S GREASY SPOON METAL SIGN,Home,Decoration
82567,"AIRLINE LOUNGE,METAL SIGN",Home,Decoration
82578,KITCHEN METAL SIGN,Home,Decoration
82580,BATHROOM METAL SIGN,Home,Decoration
82581,TOILET METAL SIGN,Home,Decoration
82582,AREA PATROLLED METAL SIGN,Home,Decoration
82583,HOT BATHS METAL SIGN,Home,Decoration
82585,SWEET VALENCIA CANDLE+CUP,Air fragances,Candles
82587,TEXRIO TOMATOES CANDLE+CUP,Air fragances,Candles
82597,BOMBS AWAY METAL SIGN,Home,Decoration
82599,FANNY'S REST STOPMETAL SIGN,Seasonal,Summer
82600,NO SINGING METAL SIGN,Home,Decoration
82605,OLD DOC RUSSEL METAL SIGN,Home,Decoration
82607A,GLASS BONBON JAR PARFUME AUX FLEURE,Home,Kitchen
82607C,GLASS BONBON JAR. SUPERFINES,Home,Kitchen
82607E,GLASS BONBON JAR. D'AMANDES,Home,Kitchen
82613A,"METAL SIGN,CUPCAKE SINGLE HOOK",Home,Kitchen
82613B,"METAL SIGN,CUPCAKE SINGLE HOOK",Home,Kitchen
82613C,"METAL SIGN,CUPCAKE SINGLE HOOK",Home,Kitchen
82613D,METAL SIGN CUPCAKE SINGLE HOOK,Home,Kitchen
82613a,"METAL SIGN,CUPCAKE SINGLE HOOK",Home,Kitchen
82613b,"METAL SIGN,CUPCAKE SINGLE HOOK",Home,Kitchen
82613c,"METAL SIGN,CUPCAKE SINGLE HOOK",Home,Kitchen
82615,PINK MARSHMALLOW SCARF KNITTING KIT,Hobbies,Crafts
82616A,BUBBLE GUM SCARF KNITTING KIT,Hobbies,Crafts
82616B,FRAPPUCINO SCARF KNITTING KIT,Hobbies,Crafts
82616C,MIDNIGHT GLAMOUR SCARF KNITTING KIT,Hobbies,Crafts
84007,MAGIC GARDEN MOUNT FUJI,Hobbies,Garden
84029C,BROWN FURRY HOT WATER BOTTLE,Home,Kitchen
84029D,LEOPARD PRINT HOT WATER BOTTLE,Home,Kitchen
84029G,KNITTED UNION FLAG HOT WATER BOTTLE,Home,Kitchen
84029c,BROWN FURRY HOT WATER BOTTLE,Home,Kitchen
84030B,KNITTED POM POM HOT WATER BOTTLE,Home,Kitchen
84030C,KNITTED RAINBOW HOT WATER BOTTLE,Home,Kitchen
84030E,ENGLISH ROSE HOT WATER BOTTLE,Home,Kitchen
84030b,KNITTED POM POM HOT WATER BOTTLE,Home,Kitchen
84030c,KNITTED RAINBOW HOT WATER BOTTLE,Home,Kitchen
84030e,ENGLISH ROSE HOT WATER BOTTLE,Home,Kitchen
84031A,CHARLIE+LOLA RED HOT WATER BOTTLE ,Home,Kitchen
84031B,CHARLIE LOLA BLUE HOT WATER BOTTLE ,Home,Kitchen
84031a,CHARLIE+LOLA RED HOT WATER BOTTLE ,Home,Kitchen
84031b,CHARLIE LOLA BLUE HOT WATER BOTTLE ,Home,Kitchen
84032A,CHARLIE+LOLA PINK HOT WATER BOTTLE,Home,Kitchen
84032B,CHARLIE + LOLA RED HOT WATER BOTTLE,Home,Kitchen
84050,PINK HEART SHAPE EGG FRYING PAN,Home,Kitchen
84077,WORLD WAR 2 GLIDERS ASSTD DESIGNS,Kids,Toys
84078A,SET/4 WHITE RETRO STORAGE CUBES ,Home,Furniture
84081,WHITE CERAMIC PARTY SET (5PCS),Kids,Party
84201B,HAPPY BIRTHDAY CARD STRIPEY TEDDY,Stationery,Gifts
84201C,HAPPY BIRTHDAY CARD TEDDY/CAKE,Stationery,Gifts
84205C,HAPPY BIRTHDAY GINGER CAT CARD,Stationery,Gifts
84206A,3 BLACK CATS W HEARTS BLANK CARD,Stationery,Gifts
84206B,CAT WITH SUNGLASSES BLANK CARD,Stationery,Gifts
84206C,CHAMPAGNE TRAY BLANK CARD,Stationery,Gifts
84231,EASTER BUNNY WITH BASKET ON BACK,Seasonal,Easter
84247C,PACK/12 BLUE REINDEER CARD,Stationery,Gifts
84247E,PACK/12 XMAS FUN CARD,Stationery,Gifts
84247G,"DECOUPAGE,GREETING CARD,",Stationery,Gifts
84247H,PACK/12 DECOUPAGE CARD,Hobbies,Crafts
84247J,PACK/12 RUSSIAN DOLL CARDS,Stationery,Gifts
84247K,"FOLK ART GREETING CARD,pack/12",Stationery,Gifts
84247L,FAWN AND MUSHROOM GREETING CARD,Stationery,Gifts
84247N,PACK/12 BLUE FOLKART CARDS,Stationery,Gifts
84249A,"GREETING CARD,SQUARE, DOUGHNUTS",Stationery,Gifts
84249D,FAIRY CAKE GREETINGS CARD,Home,Kitchen
84250M,"GREETING CARD, BLACKPOOL ROCK",Stationery,Gifts
84251B,"GREETING CARD, STICKY GORDON",Stationery,Gifts
84251C,"GREETING CARD, TWO SISTERS.",Stationery,Gifts
84251F,"GREETING CARD, RITA",Stationery,Gifts
84251G,"GREETING CARD, OVERCROWDED POOL.",Stationery,Gifts
84251J,"GREETING CARD, THE BLACK CAT",Stationery,Gifts
84255A,PINK GLASS COCKTAIL LAMP,Home,Furniture
84255B,ORANGE COCKTAIL GLASS LAMP,Home,Furniture
84311,CAMOFLAGE CUSHION COVER,Home,Furniture
84340,LARGE FIBRE OPTIC CHRISTMAS TREE,Seasonal,Christmas
84341B,SMALL PINK MAGIC CHRISTMAS TREE,Seasonal,Christmas
84347,ROTATING SILVER ANGELS T-LIGHT HLDR,Air fragances,Candles
84352,SILVER CHRISTMAS TREE BAUBLE STAND ,Seasonal,Christmas
84358,FLOOR LAMP SHADE WOOD BASE,Home,Furniture
84360,TABLE LAMP WHITE SHADE WOOD BASE,Home,Furniture
84375,SET OF 20 KIDS COOKIE CUTTERS,Home,Kitchen
84378,SET OF 3 HEART COOKIE CUTTERS,Home,Kitchen
84380,SET OF 3 BUTTERFLY COOKIE CUTTERS,Home,Kitchen
84406B,CREAM CUPID HEARTS COAT HANGER,Home,Furniture
84406b,CREAM CUPID HEARTS COAT HANGER,Home,Furniture
84415A,PINK FLOCK SUEDE CUSHION COVER ,Home,Furniture
84415B,BLUE FLOCK CUSHION COVER ,Home,Furniture
84422,PINK/BLUE DISC/MIRROR STRING,Home,Bathroom
84424A,FOUR PICTURE WHITE GLASS FRAME,Hobbies,Photo
84425A,WHITE GLASS TV TRIPLE FRAME,Hobbies,Photo
84427B,BLACK GLASS TV DOUBLE P/FRAME 15X10,Hobbies,Photo
84437A,S/6 PINK EASTER DECS IN BOX,Seasonal,Easter
84447,6 RABBIT CHAIN EASTER,Seasonal,Easter
84450A,PINK RABBIT SITTING EASTER,Seasonal,Easter
84450B,PINK/YELLOW RABBIT SAT EASTER,Seasonal,Easter
84452,METAL RABBIT LADDER EASTER ,Seasonal,Easter
84454,WOBBLING METAL CHICKEN EASTER,Seasonal,Easter
84455,SET OF 3 RABBIT CARROTS EASTER,Seasonal,Easter
84456,SET OF 3 RABBIT EGG EASTER,Seasonal,Easter
84457,SET/3 RABBITS FLOWER SKIPPPING ROPE,Kids,Toys
84458,S/3 RABBIT FLOWER/EGG/CARROT ROPE,Kids,Toys
84466,TOP SECRET PEN SET,Stationery,Desktop Stationery
84469,ROSE DES PADDED FLOOR CUSHION,Home,Furniture
84497,BUTTONS AND STRIPES NOTEBOOK ,Stationery,Notebooks
84499,BLACK FLOWER CANDLE PLATE,Air fragances,Candles
84509A,SET OF 4 ENGLISH ROSE PLACEMATS,Home,Furniture
84509B,SET OF 4 FAIRY CAKE PLACEMATS,Home,Furniture
84509C,SET OF 4 POLKADOT PLACEMATS ,Home,Furniture
84509E,SET OF 4 CAROUSEL PLACEMATS ,Home,Furniture
84509F,SET OF 4 NEW ENGLAND PLACEMATS,Home,Furniture
84509G,SET OF 4 FAIRY CAKE PLACEMATS ,Home,Furniture
84509a,SET OF 4 ENGLISH ROSE PLACEMATS,Home,Furniture
84509b,SET OF 4 FAIRY CAKE PLACEMATS,Home,Furniture
84509c,SET OF 4 POLKADOT PLACEMATS ,Home,Furniture
84509e,SET OF 4 CAROUSEL PLACEMATS ,Home,Furniture
84509g,SET OF 4 FAIRY CAKE PLACEMATS ,Home,Furniture
84510A,SET OF 4 ENGLISH ROSE COASTERS,Home,Kitchen
84510B,SET OF 4 FAIRY CAKES COASTERS ,Home,Kitchen
84510C,SET OF 4 POLKADOT COASTERS,Home,Kitchen
84510E,SET OF 4 GREEN CAROUSEL COASTERS,Home,Kitchen
84510F,SET OF 4 NEW ENGLAND COASTERS ,Home,Kitchen
84510a,SET OF 4 ENGLISH ROSE COASTERS,Home,Kitchen
84510b,SET OF 4 FAIRY CAKES COASTERS ,Home,Kitchen
84510c,SET OF 4 POLKADOT COASTERS,Home,Kitchen
84510e,SET OF 4 GREEN CAROUSEL COASTERS,Home,Kitchen
84519A,TOMATO CHARLIE+LOLA COASTER SET,Home,Furniture
84519B,CARROT CHARLIE+LOLA COASTER SET,Home,Kitchen
84520B,PACK 20 ENGLISH ROSE PAPER NAPKINS,Home,Paper
84520D,PACK OF 20 FAIRY CAKE PAPER NAPKINS,Home,Paper
84520b,PACK 20 ENGLISH ROSE PAPER NAPKINS,Home,Paper
84522,PINK PARTY SUNGLASSES,Kids,Party
84532B,FAIRY CAKES RECTANGLUAR BOXES,Home,Kitchen
84533B,FAIRY CAKES ROUND NESTING BOXES,Home,Kitchen
84534B,FAIRY CAKE NOTEBOOK A5 SIZE,Stationery,Notebooks
84534b,FAIRY CAKE NOTEBOOK A5 SIZE,Stationery,Notebooks
84535A,ENGLISH ROSE NOTEBOOK A6 SIZE,Stationery,Notebooks
84535B,FAIRY CAKES NOTEBOOK A6 SIZE,Stationery,Notebooks
84536A,ENGLISH ROSE NOTEBOOK A7 SIZE,Stationery,Notebooks
84536B,FAIRY CAKES NOTEBOOK A7 SIZE,Stationery,Notebooks
84536a,ENGLISH ROSE NOTEBOOK A7 SIZE,Stationery,Notebooks
84536b,FAIRY CAKES NOTEBOOK A7 SIZE,Stationery,Notebooks
84537B,FAIRY CAKES GIFT BAG,Stationery,Gifts
84539,KNITTED RABBIT DOLL ,Kids,Toys
84546,CROCHET POODLE KEYRING,Accessories,Bijoux
84548,CROCHET BEAR RED/BLUE  KEYRING,Kids,Toys
84549,CROCHET WHITE RABBIT KEYRING ,Kids,Toys
84550,CROCHET LILAC/RED BEAR KEYRING,Kids,Toys
84551,CROCHET DOG KEYRING,Accessories,Bijoux
84558A,3D DOG PICTURE PLAYING CARDS,Stationery,Gifts
84558a,3D DOG PICTURE PLAYING CARDS,Stationery,Gifts
84559A,3D SHEET OF DOG STICKERS,Stationery,Stickers
84559B,3D SHEET OF CAT STICKERS,Stationery,Stickers
84559D,3D SHEET OF SEA WORLD STICKERS,Stationery,Stickers
84559a,3D SHEET OF DOG STICKERS,Stationery,Stickers
84559b,3D SHEET OF CAT STICKERS,Stationery,Stickers
84559d,3D SHEET OF SEA WORLD STICKERS,Stationery,Stickers
84562A,PINK/WHITE RIBBED MELAMINE JUG,Home,Kitchen
84562B,BLUE/WHITE RIBBED MELAMINE JUG,Home,Kitchen
84563A,PINK & WHITE BREAKFAST TRAY,Home,Kitchen
84563B,BLUE & WHITE BREAKFAST TRAY,Home,Kitchen
84564,6 SEGMENT COLOURED SNACK BOWL ,Home,Furniture
84568,GIRLS ALPHABET IRON ON PATCHES ,Kids,Toys
84576,BLUE CAT BISCUIT BARREL PINK HEART,Home,Kitchen
84578,ELEPHANT TOY WITH BLUE T-SHIRT,Kids,Toys
84580,MOUSE TOY WITH PINK T-SHIRT,Kids,Toys
84581,DOG TOY WITH PINK CROCHET SKIRT,Kids,Toys
84586L,"PINK ROSES/GINGHAM PATCH RABBIT 8""",Kids,Toys
84592,CROCHET ROSE PURSE WITH SUEDE BACK,Accessories,Bags
84593,CROCHET ROSE DES CLOTHES HANGER,Home,Furniture
84595B,LARGE TRIFLE DESIGN L BLUE BOWL,Home,Furniture
84595E,LARGE TORTILLA DESIGN RED BOWL,Home,Furniture
84596B,SMALL DOLLY MIX DESIGN ORANGE BOWL,Home,Furniture
84596E,SMALL LICORICE DES PINK BOWL,Home,Furniture
84596F,SMALL MARSHMALLOWS PINK BOWL,Home,Furniture
84596G,SMALL CHOCOLATES PINK BOWL,Home,Furniture
84596I,WRAP SWEETS LIGHT PINK SMALL BOWL,Stationery,Gifts
84596J,MIXED NUTS LIGHT GREEN BOWL,Home,Furniture
84596K,JELLY BABIES YELLOW SMALL BOWL,Home,Furniture
84596L,BISCUITS SMALL BOWL LIGHT BLUE,Home,Furniture
84596b,SMALL DOLLY MIX DESIGN ORANGE BOWL,Home,Furniture
84596e,SMALL LICORICE DES PINK BOWL,Home,Furniture
84596f,SMALL MARSHMALLOWS PINK BOWL,Home,Furniture
84596g,SMALL CHOCOLATES PINK BOWL,Home,Furniture
84596j,MIXED NUTS LIGHT GREEN BOWL,Home,Furniture
84596l,BISCUITS SMALL BOWL LIGHT BLUE,Home,Furniture
84597B,RETRO BROWN BALL ASHTRAY ,Home,Furniture
84597C,RETRO PINK BALL ASHTRAY ,Home,Furniture
84599,CANDY STRIPE ROSE FLOOR CUSHION,Home,Furniture
84601A,NEW BAROQUE IVORY CUSHION COVER ,Home,Furniture
84608,ORNATE EDWARDIAN CANDLE HOLDER,Air fragances,Candles
84609,TALL ROCOCO CANDLE HOLDER,Air fragances,Candles
84612B,SET/4 BLACK  BAROQUE FLOCK COASTER,Home,Kitchen
84613A,PINK NEW BAROQUE FLOCK CANDLESTICK,Air fragances,Candles
84613C,BLUE NEW BAROQUE FLOCK CANDLESTICK,Air fragances,Candles
84614A,PINK BAROQUE FLOCK CANDLE HOLDER,Air fragances,Candles
