StockCode,Description,Category,Subcategory
10002R,ROBOT PENCIL SHARPNER,Stationery,Desktop Stationery
10109,BENDY COLOUR PENCILS,Stationery,Desktop Stationery
10120,DOGGY RUBBER,Stationery,Desktop Stationery
10123C,HEARTS WRAPPING TAPE ,Stationery,Desktop Stationery
10123G,ARMY CAMO WRAPPING TAPE,Stationery,Desktop Stationery
10124A,SPOTS ON RED BOOKCOVER TAPE,Stationery,Desktop Stationery
10124G,ARMY CAMO BOOKCOVER TAPE,Stationery,Desktop Stationery
10125,MINI FUNKY DESIGN TAPES,Stationery,Desktop Stationery
10133,COLOURING PENCILS BROWN TUBE,Stationery,Desktop Stationery
10134,COLOURING PENCILS BROWN TUBE,Stationery,Desktop Stationery
10135,COLOURING PENCILS BROWN TUBE,Stationery,Desktop Stationery
10138,ASSORTED COLOUR JUMBO PEN,Stationery,Desktop Stationery
11001,ASSTD DESIGN RACING CAR PEN,Stationery,Desktop Stationery
15030,FAN BLACK FRAME ,Hobbies,Photo
15034,PAPER POCKET TRAVELING FAN ,Seasonal,Summer
15036,ASSORTED COLOURS SILK FAN,Seasonal,Summer
15039,SANDALWOOD FAN,Seasonal,Summer
15044A,PINK PAPER PARASOL ,Seasonal,Summer
15044B,BLUE PAPER PARASOL ,Seasonal,Summer
15044C,PURPLE PAPER PARASOL,Seasonal,Summer
15044D,RED PAPER PARASOL,Seasonal,Summer
15056BL,EDWARDIAN PARASOL BLACK,Seasonal,Summer
15056N,EDWARDIAN PARASOL NATURAL,Seasonal,Summer
15056P,EDWARDIAN PARASOL PINK,Seasonal,Summer
15056bl,EDWARDIAN PARASOL BLACK,Seasonal,Summer
15056n,EDWARDIAN PARASOL NATURAL,Seasonal,Summer
15056p,EDWARDIAN PARASOL PINK,Seasonal,Summer
15058A,BLUE POLKADOT GARDEN PARASOL,Seasonal,Summer
15058B,PINK POLKADOT GARDEN PARASOL,Seasonal,Summer
15058C,ICE CREAM DESIGN GARDEN PARASOL,Seasonal,Summer
15059A,ENGLISH ROSE EDWARDIAN PARASOL,Seasonal,Summer
15060B,FAIRY CAKE DESIGN UMBRELLA,Seasonal,Summer
15060b,FAIRY CAKE DESIGN UMBRELLA,Seasonal,Summer
16008,SMALL FOLDING SCISSOR(POINTED EDGE),Stationery,Desktop Stationery
16010,FOLDING CAMPING SCISSOR W/KNIF & S,Stationery,Desktop Stationery
16011,ANIMAL STICKERS,Stationery,Stickers
16012,FOOD/DRINK SPONGE STICKERS,Stationery,Stickers
16014,SMALL CHINESE STYLE SCISSOR,Stationery,Desktop Stationery
16015,MEDIUM CHINESE STYLE SCISSOR,Stationery,Desktop Stationery
16016,LARGE CHINESE STYLE SCISSOR,Stationery,Desktop Stationery
16020C,CLEAR STATIONERY BOX SET ,Stationery,Desktop Stationery
16033,MINI HIGHLIGHTER PENS,Stationery,Desktop Stationery
16043,POP ART PUSH DOWN RUBBER ,Stationery,Desktop Stationery
16044,POP-ART FLUORESCENT PENS,Stationery,Desktop Stationery
16045,POPART WOODEN PENCILS ASST,Stationery,Desktop Stationery
16046,TEATIME PEN CASE & PENS,Stationery,Desktop Stationery
16047,POP ART PEN CASE & PENS,Stationery,Desktop Stationery
16048,TEATIME ROUND PENCIL SHARPENER ,Stationery,Desktop Stationery
16049,TEATIME GEL PENS ASST,Stationery,Desktop Stationery
16050,TEATIME PENCIL WITH RUBBER,Stationery,Desktop Stationery
16051,TEATIME PENCIL W STAMP ASST,Stationery,Desktop Stationery
16052,TEATIME PUSH DOWN RUBBER,Stationery,Desktop Stationery
16053,POPART COL BALLPOINT PEN ASST,Stationery,Desktop Stationery
16054,POPART RECT PENCIL SHARPENER ASST,Stationery,Desktop Stationery
16119,FUNKY GIRL ADDRESS BOOK,Stationery,Notebooks
16151A,FLOWERS HANDBAG blue and orange,Accessories,Bags
16156L,"WRAP, CAROUSEL",Stationery,Gifts
16156N,"WRAP, FRIENDSHIP ON GREEN",Stationery,Gifts
16156S,WRAP PINK FAIRY CAKES ,Stationery,Gifts
16161C,WRAP SPEED DEMONS ,Stationery,Gifts
16161E,WRAP BOUDOIR ,Stationery,Gifts
16161G,WRAP BAD HAIR DAY,Stationery,Gifts
16161M,WRAP  PINK FLOCK,Stationery,Gifts
16161P,WRAP ENGLISH ROSE ,Stationery,Gifts
16161U,WRAP SUKI AND FRIENDS,Stationery,Gifts
16162L,THE KING GIFT BAG,Stationery,Gifts
16162M,THE KING GIFT BAG 25x24x12cm,Stationery,Gifts
16168M,FUNKY MONKEY GIFT BAG MEDIUM,Stationery,Gifts
16168S,FUNKY MONKEY GIFT BAG SMALL,Stationery,Gifts
16169A,WRAP CHRISTMAS DECOUPAGE,Stationery,Gifts
16169C,WRAP BLUE REINDEER,Stationery,Gifts
16169D,WRAP WINTER FOREST,Stationery,Gifts
16169E,WRAP 50'S  CHRISTMAS,Stationery,Gifts
16169F,WRAP BLIZZARD,Stationery,Gifts
16169G,WRAP ROMANTIC DECOUPAGE,Stationery,Gifts
16169K,WRAP FOLK ART,Stationery,Gifts
16169M,WRAP DAISY CARPET ,Stationery,Gifts
16169N,WRAP BLUE RUSSIAN FOLKART,Stationery,Gifts
16169P,WRAP GREEN RUSSIAN FOLKART ,Stationery,Gifts
16192,PINK BALLET OPENING CUBE BOX ,Stationery,Desktop Stationery
16201A,PASTEL PINK PHOTO ALBUM,Hobbies,Photo
16201B,PASTEL BLUE PHOTO ALBUM,Hobbies,Photo
16202A,PASTEL PINK PHOTO ALBUM ,Hobbies,Photo
16202B,PASTEL BLUE PHOTO ALBUM ,Hobbies,Photo
16202C,BEIGE PHOTO ALBUM,Hobbies,Photo
16202E,BLACK PHOTO ALBUM ,Hobbies,Photo
16206B,RED PURSE WITH PINK HEART,Accessories,Bags
16207A,PINK STRAWBERRY HANDBAG ,Accessories,Bags
16207B,PINK HEART RED HANDBAG,Accessories,Bags
16212,FUNKY GIRLZ ASST MAGNETIC MEMO PAD,Stationery,Notebooks
16215,FUNKY GIRLZ MAGNETIC TO DO LIST ,Stationery,Notebooks
16216,LETTER SHAPE PENCIL SHARPENER,Stationery,Desktop Stationery
16218,CARTOON  PENCIL SHARPENERS,Stationery,Desktop Stationery
16219,HOUSE SHAPE PENCIL SHARPENER,Stationery,Desktop Stationery
16225,RATTLE SNAKE EGGS,Kids,Toys
16235,RECYCLED PENCIL WITH RABBIT ERASER,Stationery,Desktop Stationery
16236,KITTY PENCIL ERASERS,Stationery,Desktop Stationery
16237,SLEEPING CAT ERASERS,Stationery,Desktop Stationery
16238,PARTY TIME PENCIL ERASERS,Stationery,Desktop Stationery
16239,BALLERINA HEART DECORATION.,Home,Decoration
16243B,BROWN COZY SQUARE PHOTO ALBUM,Hobbies,Photo
16245A,PINK MINI STATIONERY SET W CASE,Stationery,Desktop Stationery
16248B,BLUE HOLE PUNCH,Stationery,Desktop Stationery
16254,TRANSPARENT ACRYLIC TAPE DISPENSER,Stationery,Desktop Stationery
16256B,FLOWER PENCIL/RUBBER+5 MINI PENCILS,Stationery,Desktop Stationery
16256C,HEARTS PENCIL/RUBBER+5 MINI PENCILS,Stationery,Desktop Stationery
16258A,SWIRLY CIRCULAR RUBBERS IN BAG,Stationery,Desktop Stationery
16258B,DAISY ERASERS IN BAG,Stationery,Desktop Stationery
16259,PIECE OF CAMO STATIONERY SET,Stationery,Desktop Stationery
17001,HEAVENS SCENT FRAGRANCE OILS ASSTD,Air fragances,Candles
17003,BROCADE RING PURSE ,Accessories,Bags
17007B,S/3 POT POURI CUSHIONS BLUE COLOURS,Home,Furniture
17011A,ORIGAMI VANILLA INCENSE+FLOWER ,Air fragances,Incense
17011B,ORIGAMI JASMINE INCENSE+FLOWER ,Air fragances,Incense
17011C,ORIGAMI LAVENDER INCENSE+FLOWER,Air fragances,Incense
17011D,ORIGAMI ROSE INCENSE+FLOWER,Air fragances,Incense
17011E,ORIGAMI OPIUM SCENT INCENSE+FLOWER,Air fragances,Incense
17011F,ORIGAMI SANDLEWOOD INCENSE+FLOWER,Air fragances,Incense
17012A,ORIGAMI VANILLA INCENSE/CANDLE SET ,Air fragances,Incense
17012B,ORIGAMI JASMINE INCENSE/CANDLE SET,Air fragances,Incense
17012C,ORIGAMI LAVENDER INCENSE/CANDL SET ,Air fragances,Incense
17012D,ORIGAMI ROSE INCENSE/CANDLE SET ,Air fragances,Incense
17012E,ORIGAMI OPIUM INCENSE/CANDLE SET ,Air fragances,Incense
17012F,ORIGAMI SANDLEWOOD INCENSE/CAND SET,Air fragances,Incense
17013B,ORIGAMI JASMINE INCENSE IN TUBE,Air fragances,Incense
17013C,ORIGAMI LAVENDER INCENSE IN TUBE,Air fragances,Incense
17013D,ORIGAMI ROSE INCENSE IN TUBE,Air fragances,Incense
17013F,ORIGAMI SANDLEWOOD INCENSE IN TUBE,Air fragances,Incense
17014A,ORIGAMI VANILLA INCENSE CONES,Air fragances,Incense
17014C,ORIGAMI LAVENDER INCENSE CONES,Air fragances,Incense
17014D,ORIGAMI ROSE INCENSE CONES,Air fragances,Incense
17014E,ORIGAMI OPIUM INCENSE CONES,Air fragances,Incense
17014F,ORIGAMI SANDLEWOOD INCENSE CONES,Air fragances,Incense
17021,NAMASTE SWAGAT INCENSE,Air fragances,Incense
17027A,INCENSE BAZAAR CANNABIS,Air fragances,Incense
17028J,INCENSE BAZAAR PEACH,Air fragances,Incense
17033,"BROCADE PURSE,SMALL ARCH BUTTON",Accessories,Bags
17038,PORCELAIN BUDAH INCENSE HOLDER,Air fragances,Incense
17039,INLAID WOOD INCENSE HOLDER,Air fragances,Incense
17061,ASSORTED SHAPED STENCIL FOR HENNA,Hobbies,Crafts
17084A,TRANQUILITY MASALA INCENSE,Air fragances,Incense
17084G,MOON INCENSE,Air fragances,Incense
17084J,LOVE POTION MASALA INCENSE,Air fragances,Incense
17084N,FAIRY DREAMS INCENSE ,Air fragances,Incense
17084P,DRAGONS BLOOD INCENSE,Air fragances,Incense
17084R,ASSORTED INCENSE PACK,Air fragances,Incense
17090A,LAVENDER INCENSE 40 CONES IN TIN,Air fragances,Incense
17090D,VANILLA INCENSE 40 CONES IN TIN,Air fragances,Incense
17091A,LAVENDER INCENSE IN TIN,Air fragances,Incense
17091B,JASMINE TEA INCENSE IN TIN,Air fragances,Incense
17091F,SANDALWOOD INCENSE IN TIN,Air fragances,Incense
17091J,VANILLA INCENSE IN TIN,Air fragances,Incense
17096,ASSORTED LAQUERED INCENSE HOLDERS,Air fragances,Incense
17107D,"FLOWER FAIRY,5 SUMMER B'DRAW LINERS",Air fragances,Candles
17108D,FLOWER FAIRY SUMMER BOUQUET SACHET,Air fragances,Candles
17109A,FLOWER FAIRY INCENSE LILY,Air fragances,Incense
17109B,FLOWER FAIRY INCENSE LAVENDER,Air fragances,Incense
17109C,FLOWER FAIRY INCENSE ROSE,Air fragances,Incense
17109D,FLOWER FAIRY INCENSE BOUQUET,Air fragances,Incense
17129C,SKY BLUE COLOUR GLASS GEMS IN BAG,Accessories,Bags
17129D,CLEAR COLOUR GLASS GEMS IN BAG,Accessories,Bags
17129F,BLUE GLASS GEMS IN BAG,Accessories,Bags
17136A,BLUE STONES ON WIRE FOR CANDLE,Air fragances,Candles
17164B,ASS COL SMALL SAND GECKO P'WEIGHT,Air fragances,Candles
17164D,ASS COL SMALL SAND FROG P'WEIGHT,Air fragances,Candles
17165B,ASS COL LARGE SAND GECKO P'WEIGHT,Air fragances,Candles
17165D,ASS COL LARGE SAND FROG P'WEIGHT,Air fragances,Candles
17178,FLAT PALM T-LIGHT HOLDER,Air fragances,Candles
17181,CIRCLE OF FRIENDS CANDLE HOLDER,Air fragances,Candles
17191A,ROSE FLOWER CANDLE+INCENSE 16X16CM,Air fragances,Incense
18010,ASSORTED FRAGRANCE BATH CONFETTI,Kids,Party
18094C,WHITE AND BLUE CERAMIC OIL BURNER,Air fragances,Candles
18097A,PINK TALL PORCELAIN T-LIGHT HOLDER ,Air fragances,Candles
18097B,BLUE TALL PORCELAIN T-LIGHT HOLDER,Air fragances,Candles
18097C,WHITE TALL PORCELAIN T-LIGHT HOLDER,Air fragances,Candles
18098A,PINK PORCELAIN B'FLY OIL BURNER,Air fragances,Candles
18098B,BLUE PORCELAIN B'FLY OIL BURNER,Air fragances,Candles
18098C,PORCELAIN BUTTERFLY OIL BURNER,Air fragances,Candles
18098c,PORCELAIN BUTTERFLY OIL BURNER,Air fragances,Candles
20615,BLUE SPOTTY PASSPORT COVER,Accessories,Bags
20616,CHERRY BLOSSOM PASSPORT COVER,Accessories,Bags
20617,FIRST CLASS PASSPORT COVER ,Accessories,Bags
20618,QUEEN OF THE SKIES PASSPORT COVER ,Accessories,Bags
20619,TROPICAL PASSPORT COVER ,Accessories,Bags
20620,RED SPOTTY PASSPORT COVER,Accessories,Bags
20621,ECONOMY PASSPORT COVER ,Accessories,Bags
20622,VIPPASSPORT COVER ,Accessories,Bags
20652,BLUE SPOTTY LUGGAGE TAG ,Accessories,Bags
20653,CHERRY BLOSSOM LUGGAGE TAG,Accessories,Bags
20654,FIRST CLASS LUGGAGE TAG ,Accessories,Bags
20655,QUEEN OF SKIES LUGGAGE TAG,Accessories,Bags
20657,TROPICAL LUGGAGE TAG,Accessories,Bags
20658,RED SPOTTY LUGGAGE TAG,Accessories,Bags
20659,ECONOMY LUGGAGE TAG,Accessories,Bags
20660,VIP LUGGAGE TAG ,Accessories,Bags
20661,BLUE SPOTTY PURSE ,Accessories,Bags
20662,FIRST CLASS HOLIDAY PURSE ,Accessories,Bags
20663,QUEEN OF THE SKIES HOLIDAY PURSE ,Accessories,Bags
20664,TROPICAL HOLIDAY PURSE ,Accessories,Bags
20665,RED SPOTTY PURSE ,Accessories,Bags
20666,ECONOMY HOLIDAY PURSE,Accessories,Bags
20667,CHERRY BLOSSOM PURSE,Accessories,Bags
20668,DISCO BALL CHRISTMAS DECORATION,Seasonal,Christmas
20669,RED HEART LUGGAGE TAG,Accessories,Bags
20670,VIP HOLIDAY PURSE,Accessories,Bags
20671,BLUE TEATIME PRINT BOWL ,Home,Kitchen
20672,PINK TEATIME PRINT BOWL,Home,Kitchen
20673,STRAWBERRIES PRINT BOWL,Home,Furniture
20674,GREEN POLKADOT BOWL,Home,Furniture
20675,BLUE POLKADOT BOWL,Home,Furniture
20676,RED RETROSPOT BOWL,Home,Furniture
20677,PINK POLKADOT BOWL,Home,Furniture
20678,LARGE BLACK DIAMANTE HAIRSLIDE,Accessories,Bijoux
20679,EDWARDIAN PARASOL RED,Seasonal,Summer
20680,PINK FLOWERS CHILDS UMBRELLA,Seasonal,Summer
20681,PINK SPOTTY CHILDS UMBRELLA,Seasonal,Summer
20682,RED RETROSPOT CHILDRENS UMBRELLA,Seasonal,Summer
20683,RAIN GIRL CHILDS UMBRELLA,Seasonal,Summer
20684,STRAWBERRY DREAM CHILDS UMBRELLA,Seasonal,Summer
20685,DOORMAT RED RETROSPOT,Home,Furniture
20686,DOLLY MIXTURE CHILDREN'S UMBRELLA,Seasonal,Summer
20688,BEAUTY SPEED EXPRESSO CUPS,Home,Kitchen
20689,RETRO SISTERS EXPRESSO CUPS,Home,Kitchen
20692,FLORAL ELEPHANT SOFT TOY,Kids,Toys
20694,FLORAL PINK MONSTER,Kids,Toys
20695,FLORAL BLUE MONSTER,Kids,Toys
20696,FLORAL SOFT CAR TOY,Kids,Toys
20697,LITTLE GREEN MONSTER SOFT TOY,Kids,Toys
20698,LITTLE PINK MONSTER SOFT TOY,Kids,Toys
20699,MOUSEY LONG LEGS SOFT TOY,Kids,Toys
20700,GREEN CAT FLORAL CUSHION COVER ,Home,Furniture
20701,PINK CAT FLORAL CUSHION COVER ,Home,Furniture
20704,MR ROBOT SOFT TOY,Kids,Toys
20705,MRS ROBOT SOFT TOY,Kids,Toys
20707,CRAZY DAISY HEART DECORATION,Home,Decoration
20711,JUMBO BAG TOYS ,Accessories,Bags
20712,JUMBO BAG WOODLAND ANIMALS,Accessories,Bags
20713,JUMBO BAG OWLS,Accessories,Bags
20714,POSY SHOPPER BAG,Accessories,Bags
20716,PARTY FOOD SHOPPER BAG,Accessories,Bags
20717,STRAWBERRY SHOPPER BAG,Accessories,Bags
20718,RED SPOTTY SHOPPER BAG,Accessories,Bags
20719,WOODLAND CHARLOTTE BAG,Accessories,Bags
20721,OWLS CHARLOTTE BAG,Accessories,Bags
20723,STRAWBERRY CHARLOTTE BAG,Accessories,Bags
20724,RED RETROSPOT CHARLOTTE BAG,Accessories,Bags
20725,LUNCH BAG RED RETROSPOT,Accessories,Bags
20726,LUNCH BAG WOODLAND,Accessories,Bags
20727,LUNCH BAG  BLACK SKULL.,Accessories,Bags
20728,LUNCH BAG CARS BLUE,Accessories,Bags
20729,RED SPOTTY CANDY BAG,Accessories,Bags
20730,STRAWBERRY CANDY BAG,Accessories,Bags
20731,POSY CANDY BAG,Accessories,Bags
20733,GOLD MINI TAPE MEASURE ,Stationery,Desktop Stationery
20734,SILVER MINI TAPE MEASURE ,Stationery,Desktop Stationery
20735,BLACK MINI TAPE MEASURE ,Stationery,Desktop Stationery
20736,PINK MINI TAPE MEASURE ,Stationery,Desktop Stationery
20737,RED MINI TAPE MEASURE ,Stationery,Desktop Stationery
20738,GREEN MINI TAPE MEASURE ,Stationery,Desktop Stationery
20739,*USB Office Glitter Lamp,Home,Furniture
20747,PICCADILLY TEA SET,Home,Kitchen
20748,KENSINGTON COFFEE SET,Home,Kitchen
20751,FUNKY WASHING UP GLOVES ASSORTED,Home,Kitchen
20752,RETRO BLUE SPOTTY WASHING UP GLOVES,Home,Kitchen
20753,RETRO PINK SPOT WASHING UP GLOVES,Home,Kitchen
20754,RETRO RED SPOTTY WASHING UP GLOVES,Home,Kitchen
20755,BLUE PAISLEY POCKET BOOK,Stationery,Notebooks
20756,GREEN FERN POCKET BOOK,Stationery,Notebooks
20757,RED DAISY POCKET BOOK ,Stationery,Notebooks
20758,ABSTRACT CIRCLES POCKET BOOK,Stationery,Notebooks
20759,CHRYSANTHEMUM POCKET BOOK ,Stationery,Notebooks
20760,GARDEN PATH POCKET BOOK,Stationery,Notebooks
20761,BLUE PAISLEY SKETCHBOOK,Stationery,Notebooks
20762,GREEN FERN SKETCHBOOK ,Stationery,Notebooks
20763,DAISY SKETCHBOOK ,Stationery,Notebooks
20764,ABSTRACT CIRCLES SKETCHBOOK ,Stationery,Notebooks
20765,CHRYSANTHEMUM SKETCHBOOK ,Stationery,Notebooks
20766,GARDEN PATH SKETCHBOOK,Stationery,Notebooks
20767,BLUE PAISLEY JOURNAL ,Stationery,Notebooks
20768,GREEN FERN JOURNAL ,Stationery,Notebooks
20769,DAISY JOURNAL ,Stationery,Notebooks
20770,ABSTRACT CIRCLE JOURNAL ,Stationery,Notebooks
20771,CHRYSANTHEMUM  JOURNAL,Stationery,Notebooks
20772,GARDEN PATH JOURNAL,Stationery,Notebooks
20773,BLUE PAISLEY NOTEBOOK,Stationery,Notebooks
20774,GREEN FERN NOTEBOOK,Stationery,Notebooks
20775,DAISY NOTEBOOK ,Stationery,Notebooks
20776,ABSTRACT CIRCLES NOTEBOOK,Stationery,Notebooks
20777,CHRYSANTHEMUM NOTEBOOK,Stationery,Notebooks
20778,GARDEN PATH NOTEBOOK ,Stationery,Notebooks
20779,PINK EAR MUFF HEADPHONES,Accessories,Tech
20780,BLACK EAR MUFF HEADPHONES,Accessories,Tech
20781,GOLD EAR MUFF HEADPHONES,Accessories,Tech
20782,CAMOUFLAGE EAR MUFF HEADPHONES,Accessories,Tech
20783,HEART EAR MUFF HEADPHONES,Accessories,Tech
20784,RED RETRO BAR STOOL,Home,Furniture
20785,FUSCHIA RETRO BAR STOOL,Home,Furniture
20786,BLACK RETRO BAR STOOL,Home,Furniture
20787,BLUE RETRO BAR STOOL,Home,Furniture
20795,LARGE BLUE PROVENCAL CERAMIC BALL,Home,Kitchen
20796,SMALL BLUE PROVENCAL CERAMIC BALL,Home,Kitchen
20798,CLEAR MILKSHAKE GLASS,Home,Kitchen
20799,PINK MILKSHAKE GLASS,Home,Kitchen
20800,LARGE GLASS SUNDAE DISH CLEAR,Home,Kitchen
20801,LARGE PINK GLASS SUNDAE DISH,Home,Kitchen
20802,SMALL GLASS SUNDAE DISH CLEAR,Home,Kitchen
20803,SMALL PINK GLASS SUNDAE DISH,Home,Kitchen
20804,GLASS CHICKEN BUTTER DISH,Home,Kitchen
20812,EMBOSSED FLOWER TRELLIS PHOTO FRAME,Hobbies,Photo
20814,SILVER FINCH DECORATION,Home,Decoration
20816,GOLD FLOWER CUSHION COVER ,Home,Furniture
20818,GOLD TEDDY BEAR,Kids,Toys
20819,SILVER TEDDY BEAR,Kids,Toys
20820,SILVER LOOKING MIRROR,Home,Bathroom
20821,GOLDIE LOOKING MIRROR,Home,Bathroom
20823,GOLD WINE GOBLET,Home,Kitchen
20825,GOLD WINE GLASS,Home,Kitchen
20826,SILVER APERITIF GLASS,Home,Kitchen
20827,GOLD APERITIF GLASS,Home,Kitchen
20830,SILVER PHOTO FRAME,Hobbies,Photo
20831,GOLD PHOTO FRAME,Hobbies,Photo
20832,RED FLOCK LOVE HEART PHOTO FRAME,Hobbies,Photo
20835,FRENCH LATTICE CUSHION COVER ,Home,Furniture
20836,FRENCH PAISLEY CUSHION COVER,Home,Furniture
20837,FRENCH FLORAL CUSHION COVER ,Home,Furniture
20838,FRENCH LATTICE CUSHION COVER ,Home,Furniture
20839,FRENCH PAISLEY CUSHION COVER ,Home,Furniture
20840,FRENCH FLORAL CUSHION COVER ,Home,Furniture
20846,ZINC HEART LATTICE T-LIGHT HOLDER,Air fragances,Candles
20847,ZINC HEART LATTICE CHARGER LARGE,Accessories,Tech
20848,ZINC HEART LATTICE CHARGER SMALL,Accessories,Tech
20850,ZINC HEART LATTICE PLANTER BOWL,Home,Furniture
20854,BLUE PATCH PURSE PINK HEART,Accessories,Bags
20855,PINK PATCH PURSE BLUE HEART,Accessories,Bags
20856,DENIM PATCH PURSE PINK BUTTERFLY,Accessories,Bags
20857,BLUE ROSE PATCH PURSE PINK BUTTERFL,Accessories,Bags
20858,SILVER PURSE GOLD PINK BUTTERFLY,Accessories,Bags
20860,GOLD COSMETICS BAG WITH BUTTERFLY,Accessories,Bags
20861,GOLD COSMETIC BAG PINK STAR,Accessories,Bags
20862,PINK PATCH PENCIL CASE BLUE HEART,Stationery,Desktop Stationery
20863,BLUE PATCH PENCIL CASE PINK HEART,Stationery,Desktop Stationery
20864,DENIM PATCH PENCIL CASE BUTTERFLY,Stationery,Desktop Stationery
20865,PATCHWORK PENCIL CASE BUTTERFLY ,Stationery,Desktop Stationery
20866,BLUE ROSE FABRIC MIRROR,Home,Bathroom
20867,PINK ROSE FABRIC MIRROR,Home,Bathroom
20868,SILVER FABRIC MIRROR,Home,Bathroom
20869,GOLD FABRIC MIRROR,Home,Bathroom
20870,OPULENT VELVET CANDLE IN BOX,Air fragances,Candles
20871,OPULENT VELVET SET/3 CANDLES,Air fragances,Candles
20877,MODERN CHRISTMAS BAUBLE CANDLE ,Air fragances,Candles
20878,SET/9 CHRISTMAS T-LIGHTS SCENTED ,Air fragances,Candles
20881,MODERN CHRISTMAS TREE CANDLE,Air fragances,Candles
20882,MODERN CHRISTMAS TREE CANDLE,Air fragances,Candles
20884,MODERN CHRISTMAS TREE CANDLE ,Air fragances,Candles
20886,BOX OF 9 PEBBLE CANDLES,Air fragances,Candles
20887,BOX OF 6 PEBBLE CANDLES,Air fragances,Candles
20888,SET 3 JARDIN DE FEMME SCENT CANDLES,Air fragances,Candles
20889,JARDIN DE FEMME SCENTED CANDLE,Air fragances,Candles
20890,SMALL GLASS ROSE SCENTED CANDLE,Air fragances,Candles
20891,LARGE GLASS ROSE SCENTED CANDLE ,Air fragances,Candles
20892,SET/3 TALL GLASS CANDLE HOLDER PINK,Air fragances,Candles
20893,HANGING BAUBLE T-LIGHT HOLDER SMALL,Air fragances,Candles
20894,HANGING BAUBLE T-LIGHT HOLDER LARGE,Air fragances,Candles
20895,VINTAGE NOTEBOOK FRENCH LETTER ,Stationery,Notebooks
20896,VINTAGE NOTEBOOK PINK FLOWER,Stationery,Notebooks
20897,VINTAGE NOTEBOOK PARIS DAYS,Stationery,Notebooks
20898,VINTAGE NOTEBOOK TRAVELOGUE,Stationery,Notebooks
20899,VINTAGE NOTEBOOK RED ROSE,Stationery,Notebooks
20905,VINTAGE KEEPSAKE BOX BEAUTY GIRL,Kids,Toys
20906,VINTAGE NOTEBOOK BEAUTY GIRL,Stationery,Notebooks
20910,VINTAGE PHOTO ALBUM PARIS DAYS,Hobbies,Photo
20913,SET/5 BLUE SPOTTY LID GLASS BOWLS,Home,Furniture
20914,SET/5 RED SPOTTY LID GLASS BOWLS,Home,Furniture
20931,BLUE POT PLANT CANDLE ,Air fragances,Candles
20932,PINK POT PLANT CANDLE,Air fragances,Candles
20933,YELLOW POT PLANT CANDLE,Air fragances,Candles
20934,SET/3 POT PLANT CANDLES,Air fragances,Candles
20935,ROUND CACTUS CANDLE,Air fragances,Candles
20936,FORKED CACTUS CANDLE,Air fragances,Candles
20939,ORANGE CANDLE,Air fragances,Candles
20940,SET/6 GARDEN GNOME T-LIGHT CANDLES,Air fragances,Candles
20941,FROG CANDLE,Air fragances,Candles
20942,SET/6 GINGERBREAD TREE T-LIGHTS,Air fragances,Candles
20943,SET/6 GINGERBREAD STAR T-LIGHTS,Air fragances,Candles
20950,SET/6  ANGEL T-LIGHTS WHITE/GOLD,Air fragances,Candles
20952,PORCELAIN CHERUB BELL SMALL,Home,Decoration
20954,*USB Office Mirror Ball,Home,Bathroom
20956,PORCELAIN T-LIGHT HOLDERS ASSORTED,Air fragances,Candles
20960,WATERMELON BATH SPONGE,Home,Bathroom
20961,STRAWBERRY BATH SPONGE ,Home,Bathroom
20963,APPLE BATH SPONGE,Home,Bathroom
20966,SANDWICH BATH SPONGE,Air fragances,Candles
20967,GREY FLORAL FELTCRAFT SHOULDER BAG,Accessories,Bags
20968,GREEN FLORAL FELTCRAFT SHOULDER BAG,Accessories,Bags
20969,RED FLORAL FELTCRAFT SHOULDER BAG,Accessories,Bags
20970,PINK FLORAL FELTCRAFT SHOULDER BAG,Accessories,Bags
20971,PINK BLUE FELT CRAFT TRINKET BOX,Accessories,Bijoux
20972,PINK CREAM FELT CRAFT TRINKET BOX ,Accessories,Bijoux
20973,12 PENCIL SMALL TUBE WOODLAND,Stationery,Desktop Stationery
20974,12 PENCILS SMALL TUBE SKULL,Stationery,Desktop Stationery
20975,12 PENCILS SMALL TUBE RED RETROSPOT,Stationery,Desktop Stationery
20976,12 PENCILS SMALL TUBE POSY,Stationery,Desktop Stationery
20977,36 PENCILS TUBE WOODLAND,Stationery,Desktop Stationery
20978,36 PENCILS TUBE SKULLS,Stationery,Desktop Stationery
20979,36 PENCILS TUBE RED RETROSPOT,Stationery,Desktop Stationery
20980,36 PENCILS TUBE POSY,Stationery,Desktop Stationery
20981,12 PENCILS TALL TUBE WOODLAND,Stationery,Desktop Stationery
20982,12 PENCILS TALL TUBE SKULLS,Stationery,Desktop Stationery
20983,12 PENCILS TALL TUBE RED RETROSPOT,Stationery,Desktop Stationery
20984,12 PENCILS TALL TUBE POSY,Stationery,Desktop Stationery
20985,HEART CALCULATOR,Accessories,Tech
20986,BLUE CALCULATOR RULER,Accessories,Tech
20987,GEISHA GIRL CHOPSTICKS SET/5,Kids,Toys
20988,TRELLIS FLOWER CHOPSTICKS SET/5,Home,Kitchen
20991,JAZZ HEARTS MAGNETIC MEMO PAD,Stationery,Notebooks
20992,JAZZ HEARTS PURSE NOTEBOOK,Accessories,Bags
20993,JAZZ HEARTS MEMO PAD,Stationery,Notebooks
20996,JAZZ HEARTS ADDRESS BOOK,Stationery,Notebooks
20997,ROSE DU SUD CUSHION COVER ,Home,Furniture
20998,ROSE DU SUD OVEN GLOVE,Home,Kitchen
21000,ROSE DU SUD COSMETICS BAG,Accessories,Bags
21001,ROSE DU SUD WASHBAG ,Accessories,Bags
21002,ROSE DU SUD DRAWSTRING BAG,Accessories,Bags
21003,ROSE DU SUD CUSHION COVER,Home,Furniture
21004,ROSE DU SUD CHILDS APRON,Home,Kitchen
21007,ETCHED GLASS DROPLET DECORATION,Home,Decoration
21008,ETCHED GLASS HEART TREE DECORATION,Home,Decoration
21009,ETCHED GLASS STAR TREE DECORATION,Home,Decoration
21010,ETCHED GLASS BIRD TREE DECORATION,Home,Decoration
21011,GLITTER SNOW PEAR TREE DECORATION,Home,Decoration
21012,ANTIQUE ALL GLASS CANDLESTICK,Air fragances,Candles
21014,SWISS CHALET TREE DECORATION ,Home,Decoration
21015,DARK BIRD HOUSE TREE DECORATION,Home,Decoration
21016,LIGHT BIRD HOUSE TREE DECORATION,Home,Decoration
21017,RED BIRD HOUSE TREE DECORATION,Home,Decoration
21018,BIRD BOX CHRISTMAS TREE DECORATION,Seasonal,Christmas
21025,SPACE FROG,Kids,Toys
21026,SPACE OWL,Kids,Toys
21027,NINJA RABBIT PINK,Kids,Toys
21028,NINJA RABBIT BLACK,Kids,Toys
21030,SPACE CADET RED,Kids,Toys
21031,SPACE CADET BLACK,Kids,Toys
21032,SPACE CADET WHITE,Kids,Toys
21033,JUMBO BAG CHARLIE AND LOLA TOYS,Accessories,Bags
21034,REX CASH+CARRY JUMBO SHOPPER,Accessories,Bags
21035,SET/2 RED RETROSPOT TEA TOWELS ,Home,Kitchen
21036,SET/2 TEA TOWELS MODERN VINTAGE,Home,Kitchen
21038,SET/4 MODERN VINTAGE COTTON NAPKINS,Home,Paper
21039,RED SPOTTY SHOPPING BAG,Accessories,Bags
21040,MODERN VINTAGE COTTON SHOPPING BAG,Accessories,Bags
21041,RED RETROSPOT OVEN GLOVE DOUBLE,Home,Kitchen
21042,RED SPOTTY APRON ,Home,Kitchen
21043,APRON MODERN VINTAGE COTTON,Home,Kitchen
21051,RIBBONS PURSE ,Accessories,Bags
21054,NURSE'S BAG SOFT TOY,Accessories,Bags
21055,TOOL BOX SOFT TOY ,Kids,Toys
21056,DOCTOR'S BAG SOFT TOY,Accessories,Bags
21058,PARTY INVITES WOODLAND,Kids,Party
21059,PARTY INVITES DINOSAURS,Kids,Party
21060,PARTY INVITES BALLOON GIRL,Kids,Party
21061,PARTY INVITES FOOTBALL,Kids,Party
21062,PARTY INVITES SPACEMAN,Kids,Toys
21063,PARTY INVITES JAZZ HEARTS,Kids,Party
21065,BOOM BOX SPEAKER GIRLS,Kids,Toys
21066,VINTAGE RED MUG,Home,Kitchen
21067,VINTAGE RED TEATIME MUG,Home,Kitchen
21068,VINTAGE BILLBOARD LOVE/HATE MUG,Home,Kitchen
21069,VINTAGE BILLBOARD TEA MUG,Home,Kitchen
21070,VINTAGE BILLBOARD MUG ,Home,Kitchen
21071,VINTAGE BILLBOARD DRINK ME MUG,Home,Kitchen
21076,SET/20 COLLAGE PAPER NAPKIN ,Home,Paper
21077,SET/20 WOODLAND PAPER NAPKINS ,Home,Paper
21078,SET/20 STRAWBERRY PAPER NAPKINS ,Home,Paper
21080,SET/20 RED RETROSPOT PAPER NAPKINS ,Home,Paper
21081,SET/20 POSIES PAPER NAPKINS,Home,Paper
21082,SET/20 FRUIT SALAD PAPER NAPKINS ,Home,Paper
21084,SET/6 COLLAGE PAPER CUPS,Kids,Party
21085,SET/6 WOODLAND PAPER CUPS,Kids,Party
21086,SET/6 RED SPOTTY PAPER CUPS,Kids,Party
21087,SET/6 POSIES PAPER CUPS,Kids,Party
21088,SET/6 FRUIT SALAD PAPER CUPS,Kids,Party
21089,SET/6 GREEN SPRING PAPER CUPS,Kids,Party
21090,SET/6 COLLAGE PAPER PLATES,Kids,Party
21091,SET/6 WOODLAND PAPER PLATES,Kids,Party
21092,SET/6 STRAWBERRY PAPER PLATES,Kids,Party
21094,SET/6 RED SPOTTY PAPER PLATES,Kids,Party
21095,SET/6 POSIES PAPER PLATES,Kids,Party
21096,SET/6 FRUIT SALAD  PAPER PLATES,Home,Kitchen
21098,CHRISTMAS TOILET ROLL,Seasonal,Christmas
21099,SET/6 STRAWBERRY PAPER CUPS,Kids,Party
21100,CHARLIE AND LOLA CHARLOTTE BAG,Accessories,Bags
21102,"CANDLE IN JAR COLLAGE , VANILLA",Air fragances,Candles
